Product Name,Price,Stock,Discount,Category,Description
Candy Spot Egg Warmer Rabbit,2.51,22,0,Others,Candy Spot Egg Warmer Rabbit
Small Round Cut Glass Candlestick,10.17,33,0,Decoration,Small Round Cut Glass Candlestick
Midnight Blue Vintage Earrings,3.81,27,0,Others,Midnight Blue Vintage Earrings
Diamante Hair Grip Pack/2 Crystal,1.69,15,0,Others,Diamante Hair Grip Pack/2 Crystal
Vintage Enamel & Crystal Earrings,5.09,26,0,Others,Vintage Enamel & Crystal Earrings
Black Diamond Cluster Necklace,9.77,14,0,Others,Black Diamond Cluster Necklace
Purple Frangipani Hairclip,0.83,33,0,Others,Purple Frangipani Hairclip
Green Glass Tassle Bag Charm,1.66,31,0,Accessories,Green Glass Tassle Bag Charm
Amber Glass Tassle Bag Charm,1.66,15,0,Accessories,Amber Glass Tassle Bag Charm
Purple Glass Tassle Bag Charm,1.66,21,0,Accessories,Purple Glass Tassle Bag Charm
Turq+Red Boudicca Large Bracelet,7.22,34,0,Others,Turq+Red Boudicca Large Bracelet
Ant Copper Pink Boudicca Bracelet,5.09,19,0,Others,Ant Copper Pink Boudicca Bracelet
Pink Glass Chunky Charm Bracelet,9.34,20,0,Others,Pink Glass Chunky Charm Bracelet
Drop Diamante Earrings Purple,2.96,15,0,Others,Drop Diamante Earrings Purple
Black Chunky Bead Bracelet W Strap,9.34,23,0,Others,Black Chunky Bead Bracelet W Strap
Amber Diamante Expandable Ring,4.24,20,0,Others,Amber Diamante Expandable Ring
Pair Of Pink Flower Cluster Slide,2.54,24,0,Others,Pair Of Pink Flower Cluster Slide
Red Paper Parasol,5.91,34,0,Others,Red Paper Parasol
Silver Jewelled Mirror Trinket Tray,9.95,39,0,Others,Silver Jewelled Mirror Trinket Tray
4 Lily Botanical Dinner Candles,3.75,38,0,Decoration,4 Lily Botanical Dinner Candles
Grow A Flytrap Or Sunflower In Tin,1.25,5,0,Others,Grow A Flytrap Or Sunflower In Tin
Vintage Bead Pink Evening Bag,4.25,15,0,Accessories,Vintage Bead Pink Evening Bag
English Rose Scented Hanging Flower,4.25,29,0,Others,English Rose Scented Hanging Flower
Pink Glass Candleholder,2.95,12,0,Decoration,Pink Glass Candleholder
Cupid Design Scented Candles,2.55,39,0,Kitchen,Cupid Design Scented Candles
Square Cherry Blossom Cabinet,5.95,14,0,Others,Square Cherry Blossom Cabinet
Blue Rose Patch Purse Pink Butterfl,1.65,25,0,Others,Blue Rose Patch Purse Pink Butterfl
Wooden Regatta Bunting,5.95,15,0,Others,Wooden Regatta Bunting
Freestyle Canvas Art Picture,4.25,22,0,Others,Freestyle Canvas Art Picture
Cubic Mug Flock Pink On Brown,2.55,23,0,Kitchen,Cubic Mug Flock Pink On Brown
Porcelain Budah Incense Holder,0.07,40,0,Others,Porcelain Budah Incense Holder
Wise Man Star Shape Egg Pan,1.65,6,0,Others,Wise Man Star Shape Egg Pan
Love Potion Masala Incense,0.21,33,0,Others,Love Potion Masala Incense
Set Of 16 Vintage Red Cutlery,12.75,13,0,Others,Set Of 16 Vintage Red Cutlery
Wood Stamp Set Flowers,1.65,31,0,Others,Wood Stamp Set Flowers
Calendar Family Favourites,2.95,25,0,Others,Calendar Family Favourites
Banquet Birthday Card,0.42,36,0,Others,Banquet Birthday Card
Multicolour Spring Flower Mug,0.85,10,0,Kitchen,Multicolour Spring Flower Mug
Teatime Push Down Rubber,0.84,34,0,Kitchen,Teatime Push Down Rubber
House Shape Pencil Sharpener,1.7,38,0,Others,House Shape Pencil Sharpener
Daisy Sketchbook,7.62,33,0,Others,Daisy Sketchbook
Large Pink Glass Sundae Dish,5.06,24,0,Others,Large Pink Glass Sundae Dish
Set/3 Tall Glass Candle Holder Pink,25.49,36,0,Decoration,Set/3 Tall Glass Candle Holder Pink
Small Chunky Glass Roman Bowl,5.91,10,0,Others,Small Chunky Glass Roman Bowl
Ridged Glass T-Light Holder,1.66,21,0,Others,Ridged Glass T-Light Holder
Hanging Chick Green Decoration,2.98,5,0,Others,Hanging Chick Green Decoration
Pens Assorted Funky Jeweled,1.66,39,0,Others,Pens Assorted Funky Jeweled
T-Light Holder Sweetheart Hanging,4.21,23,0,Decoration,T-Light Holder Sweetheart Hanging
Number Tile Vintage Font 1,4.21,39,0,Others,Number Tile Vintage Font 1
Number Tile Vintage Font 4,4.21,12,0,Others,Number Tile Vintage Font 4
Number Tile Vintage Font No,4.21,15,0,Others,Number Tile Vintage Font No
Enamel Pink Tea Container,4.21,32,0,Kitchen,Enamel Pink Tea Container
4 Pink Flock Christmas Balls,3.36,17,0,Others,4 Pink Flock Christmas Balls
Tea Time Teapot In Gift Box,21.23,10,0,Kitchen,Tea Time Teapot In Gift Box
Tea Time Tea Set In Gift Box,14.43,11,0,Kitchen,Tea Time Tea Set In Gift Box
Painted Lightbulb Rainbow Design,0.84,37,0,Others,Painted Lightbulb Rainbow Design
Beaded Crystal Heart Green Large,3.36,11,0,Decoration,Beaded Crystal Heart Green Large
Set/6 Eau De Nil Bird T-Lights,4.21,13,0,Others,Set/6 Eau De Nil Bird T-Lights
Midnight Blue Copper Flower Necklac,6.37,14,0,Others,Midnight Blue Copper Flower Necklac
Rose Colour Pair Heart Hair Slides,3.81,38,0,Decoration,Rose Colour Pair Heart Hair Slides
Jade Green Enamel Hair Comb,2.11,13,0,Others,Jade Green Enamel Hair Comb
Silver Black Orbit Bracelet,5.51,8,0,Others,Silver Black Orbit Bracelet
Crystal Sea Horse Phone Charm,1.66,7,0,Others,Crystal Sea Horse Phone Charm
2 Daisies Hair Comb,2.96,34,0,Others,2 Daisies Hair Comb
Daisy Hair Comb,2.54,7,0,Others,Daisy Hair Comb
Green Drop Earrings W Bead Cluster,3.39,40,0,Others,Green Drop Earrings W Bead Cluster
Green Enamel Flower Hair Tie,2.96,7,0,Others,Green Enamel Flower Hair Tie
Red Acrylic Faceted Bangle,2.96,25,0,Others,Red Acrylic Faceted Bangle
Gardeners Kneeling Pad,3.36,16,0,Others,Gardeners Kneeling Pad
Doormat Friendship,16.98,20,0,Others,Doormat Friendship
75 Green Fairy Cake Cases,2.13,29,0,Others,75 Green Fairy Cake Cases
Country Cottage Doorstop Green,8.47,40,0,Others,Country Cottage Doorstop Green
Childs Garden Rake Blue,4.21,30,0,Others,Childs Garden Rake Blue
Set/6 Frog Prince T-Light Candles,5.06,39,0,Decoration,Set/6 Frog Prince T-Light Candles
Doorstop Football Design,7.62,5,0,Others,Doorstop Football Design
Watering Can Single Hook Pistachio,3.36,22,0,Others,Watering Can Single Hook Pistachio
French Blue Metal Door Sign 4,2.51,19,0,Others,French Blue Metal Door Sign 4
Number Tile Cottage Garden 7,4.21,13,0,Others,Number Tile Cottage Garden 7
Silver Vanilla Flower Candle Pot,3.75,8,0,Decoration,Silver Vanilla Flower Candle Pot
Pack/12 Xmas Fun Card,2.95,29,0,Others,Pack/12 Xmas Fun Card
Set/6 Black Bird T-Light Candles,2.1,9,0,Decoration,Set/6 Black Bird T-Light Candles
Set/6 Ivory Bird T-Light Candles,2.1,12,0,Decoration,Set/6 Ivory Bird T-Light Candles
French Enamel Water Basin,3.75,26,0,Others,French Enamel Water Basin
Buttons And Stripes Notebook,3.75,34,0,Others,Buttons And Stripes Notebook
Eau De Nile Jewelled T-Light Holder,0.85,38,0,Others,Eau De Nile Jewelled T-Light Holder
Tigris Eye Chunky Charm Bracelet,8.95,39,0,Others,Tigris Eye Chunky Charm Bracelet
Doorstop Racing Car Design,7.62,22,0,Others,Doorstop Racing Car Design
Vintage Union Jack Shopping Bag,10.17,21,0,Accessories,Vintage Union Jack Shopping Bag
Number Tile Cottage Garden 5,4.21,39,0,Others,Number Tile Cottage Garden 5
Pig Mug In Two Colour Designs,4.21,28,0,Kitchen,Pig Mug In Two Colour Designs
"Greeting Card, Sticky Gordon",0.85,26,0,Others,"Greeting Card, Sticky Gordon"
La Palmiera Tile Hook,4.21,40,0,Others,La Palmiera Tile Hook
S/4 Pink Flower Candles In Bowl,3.36,38,0,Decoration,S/4 Pink Flower Candles In Bowl
Mini Zinc Garden Decorations,1.66,6,0,Others,Mini Zinc Garden Decorations
Antique Opal White Flower Earrings,4.24,11,0,Others,Antique Opal White Flower Earrings
Silver M.O.P Orbit Bracelet,5.51,34,0,Others,Silver M.O.P Orbit Bracelet
Filigree Diamante Earrings,4.24,25,0,Others,Filigree Diamante Earrings
Glass Bead Hoop Earrings Black,2.96,25,0,Others,Glass Bead Hoop Earrings Black
Daisy Hair Band,1.69,29,0,Others,Daisy Hair Band
Crystal Hoop Earring Floral Leaf,2.96,36,0,Others,Crystal Hoop Earring Floral Leaf
Vintage Rose Bead Bracelet Raspberr,4.24,16,0,Others,Vintage Rose Bead Bracelet Raspberr
Jet Black Las Vegas Necklace 45Cm,5.94,9,0,Others,Jet Black Las Vegas Necklace 45Cm
"Letter ""K"" Bling Key Ring",0.85,20,0,Others,"Letter ""K"" Bling Key Ring"
"Letter ""P"" Bling Key Ring",0.85,22,0,Others,"Letter ""P"" Bling Key Ring"
"Letter ""Z"" Bling Key Ring",0.85,39,0,Others,"Letter ""Z"" Bling Key Ring"
Queen Of The Skies Holiday Purse,2.51,29,0,Others,Queen Of The Skies Holiday Purse
Blue Tile Hook,5.06,28,0,Others,Blue Tile Hook
Antique Cream Cutlery Shelf,16.98,30,0,Others,Antique Cream Cutlery Shelf
Classic French Style Basket Green,13.57,28,0,Others,Classic French Style Basket Green
Purple Las Vegas Bracelet Round,3.75,15,0,Others,Purple Las Vegas Bracelet Round
Wrap Dolly Girl,0.42,20,0,Toys,Wrap Dolly Girl
Birthday Banquet Gift Wrap,0.42,28,0,Others,Birthday Banquet Gift Wrap
Ceramic Plate Strawberry Design,1.49,36,0,Others,Ceramic Plate Strawberry Design
Baking Mould Heart Milk Chocolate,2.55,22,0,Decoration,Baking Mould Heart Milk Chocolate
Baking Mould Heart White Chocolate,2.55,14,0,Decoration,Baking Mould Heart White Chocolate
Baking Mould Chocolate Cupcakes,2.55,12,0,Kitchen,Baking Mould Chocolate Cupcakes
Wrap I Love London,0.42,27,0,Others,Wrap I Love London
Blue Scandinavian Paisley Wrap,0.42,7,0,Others,Blue Scandinavian Paisley Wrap
Baking Mould Rose White Chocolate,3.25,31,0,Others,Baking Mould Rose White Chocolate
Baking Mould Rose Milk Chocolate,3.25,30,0,Others,Baking Mould Rose Milk Chocolate
Fuschia Voile Pointy Shoe Dec,1.95,13,0,Others,Fuschia Voile Pointy Shoe Dec
Medina Stamped Metal Stool,39.95,8,0,Others,Medina Stamped Metal Stool
Pink Small Jewelled Photoframe,1.65,8,0,Others,Pink Small Jewelled Photoframe
White Hanging Beads Candle Holder,5.45,24,0,Decoration,White Hanging Beads Candle Holder
Blue New Baroque Flock Candlestick,4.65,7,0,Decoration,Blue New Baroque Flock Candlestick
Pink Paisley Cushion Cover,5.95,18,0,Others,Pink Paisley Cushion Cover
Red Retrospot Big Bowl,4.95,11,0,Others,Red Retrospot Big Bowl
Large Tall Camphor Wood Toadstool,5.45,21,0,Others,Large Tall Camphor Wood Toadstool
Queen Of The Skies Passport Cover,2.1,9,0,Others,Queen Of The Skies Passport Cover
Assorted Colour Suction Cup Hook,0.19,36,0,Kitchen,Assorted Colour Suction Cup Hook
Gingham Babushka Doorstop,3.75,32,0,Others,Gingham Babushka Doorstop
Doormat Multicolour Stripe,7.95,28,0,Others,Doormat Multicolour Stripe
Ivory Sculpted Rnd Candle,0.85,29,0,Decoration,Ivory Sculpted Rnd Candle
Folk Art Metal Heart T-Light Holder,0.38,29,0,Decoration,Folk Art Metal Heart T-Light Holder
Ceramic Bowl With Strawberry Design,2.95,9,0,Others,Ceramic Bowl With Strawberry Design
Amethyst Chunky Bead Bracelet W Str,8.95,9,0,Others,Amethyst Chunky Bead Bracelet W Str
Amber Chunky Bead Bracelet W Strap,8.95,36,0,Others,Amber Chunky Bead Bracelet W Strap
Blue Flock Cushion Cover,3.75,37,0,Others,Blue Flock Cushion Cover
Vintage Notebook Beauty Girl,2.95,26,0,Others,Vintage Notebook Beauty Girl
Zinc Top 2 Door Wooden Shelf,16.95,30,0,Others,Zinc Top 2 Door Wooden Shelf
Cd Wall Tidy Red Flowers,0.42,5,0,Others,Cd Wall Tidy Red Flowers
Magazine Rack Gebra Assorted,2.75,36,0,Others,Magazine Rack Gebra Assorted
Frosted White Base,1.66,32,0,Others,Frosted White Base
"Greeting Card, Overcrowded Pool.",0.85,29,0,Others,"Greeting Card, Overcrowded Pool."
White Silver Necklace Shell Glass,10.19,37,0,Others,White Silver Necklace Shell Glass
Murano Style Glass Bracelet Gold,3.81,14,0,Others,Murano Style Glass Bracelet Gold
Diamante Hair Grip Pack/2 Peridot,1.69,22,0,Others,Diamante Hair Grip Pack/2 Peridot
Pink Crystal Skull Phone Charm,1.66,28,0,Others,Pink Crystal Skull Phone Charm
Pink Murano Twist Bracelet,4.24,34,0,Others,Pink Murano Twist Bracelet
Green Enamel Flower Ring,2.96,11,0,Others,Green Enamel Flower Ring
Origami Rose Incense In Tube,3.36,7,0,Others,Origami Rose Incense In Tube
Assorted Laquered Incense Holders,0.43,30,0,Others,Assorted Laquered Incense Holders
Retrospot Candle Medium,4.21,31,0,Decoration,Retrospot Candle Medium
Green Birdhouse Decoration,1.66,33,0,Others,Green Birdhouse Decoration
Easter Tin Bucket,5.06,23,0,Others,Easter Tin Bucket
Large Red Retrospot Windmill,4.21,14,0,Others,Large Red Retrospot Windmill
Large Skull Windmill,4.21,22,0,Others,Large Skull Windmill
Mini Jigsaw Go To The Fair,0.85,26,0,Others,Mini Jigsaw Go To The Fair
Mini Jigsaw Leap Frog,0.85,25,0,Others,Mini Jigsaw Leap Frog
Orange Votive Candle,0.29,23,0,Decoration,Orange Votive Candle
Metal Base For Candles,0.42,9,0,Decoration,Metal Base For Candles
Floral Blue Monster,4.25,37,0,Others,Floral Blue Monster
Gift Bag Birthday,0.65,26,0,Accessories,Gift Bag Birthday
Clear Love Bird T-Light Holder,3.75,21,0,Others,Clear Love Bird T-Light Holder
Cherry Blossom Table Clock,8.95,8,0,Others,Cherry Blossom Table Clock
Regency Mirror With Shutters,165.0,32,0,Others,Regency Mirror With Shutters
Cardholder Gingham Christmas Tree,2.55,14,0,Others,Cardholder Gingham Christmas Tree
Pink Cat Bowl,2.1,18,0,Others,Pink Cat Bowl
Fawn And Mushroom Greeting Card,0.42,30,0,Others,Fawn And Mushroom Greeting Card
Baking Mould Chocolate Cup Cakes,2.55,23,0,Kitchen,Baking Mould Chocolate Cup Cakes
Pink Regency Teacup And Saucer,2.95,8,0,Kitchen,Pink Regency Teacup And Saucer
Green Square Compact Mirror,3.75,13,0,Others,Green Square Compact Mirror
Blue Heart Compact Mirror,3.75,12,0,Decoration,Blue Heart Compact Mirror
Assorted Colour Metal Cat,1.25,36,0,Others,Assorted Colour Metal Cat
Triangular Pouffe Vintage,14.95,15,0,Others,Triangular Pouffe Vintage
Felt Toadstool Large,1.25,23,0,Others,Felt Toadstool Large
4 Lavender Botanical Dinner Candles,3.75,25,0,Decoration,4 Lavender Botanical Dinner Candles
Cake Stand 3 Tier Magic Garden,10.95,24,0,Others,Cake Stand 3 Tier Magic Garden
Baking Mould Easter Egg Milk Choc,2.95,26,0,Others,Baking Mould Easter Egg Milk Choc
Doormat Merry Christmas Red,7.95,14,0,Others,Doormat Merry Christmas Red
Cut Glass T-Light Holder Octagon,2.55,23,0,Others,Cut Glass T-Light Holder Octagon
Set/4 Spring Flower Decoration,2.95,13,0,Others,Set/4 Spring Flower Decoration
Ass Col Circle Mobile,0.42,16,0,Others,Ass Col Circle Mobile
"Flower Glass Garland Neckl.36""Black",7.95,19,0,Others,"Flower Glass Garland Neckl.36""Black"
*Boombox Ipod Classic,16.98,39,0,Accessories,*Boombox Ipod Classic
White Goose Feather Tree 60Cm,5.91,28,0,Others,White Goose Feather Tree 60Cm
Retrospot Candle Small,3.36,33,0,Decoration,Retrospot Candle Small
Frying Pan Blue Polkadot,8.47,10,0,Others,Frying Pan Blue Polkadot
Egg Cup Natural Chicken,2.51,27,0,Kitchen,Egg Cup Natural Chicken
Wheelbarrow For Children,25.49,15,0,Others,Wheelbarrow For Children
Magic Sheep Wool Growing From Paper,5.06,9,0,Others,Magic Sheep Wool Growing From Paper
Pink Hearts Light Chain,9.32,9,0,Decoration,Pink Hearts Light Chain
Red Kukui Coconut Seed Necklace,5.94,30,0,Others,Red Kukui Coconut Seed Necklace
Brown Kukui Coconut Seed Necklace,5.94,27,0,Others,Brown Kukui Coconut Seed Necklace
Fire Polished Glass Bracelet Montan,3.81,18,0,Others,Fire Polished Glass Bracelet Montan
Fire Polished Glass Bracelet Green,3.81,38,0,Others,Fire Polished Glass Bracelet Green
Clear Crystal Star Phone Charm,1.66,14,0,Others,Clear Crystal Star Phone Charm
Pink Leaves And Beads Phone Charm,2.51,36,0,Others,Pink Leaves And Beads Phone Charm
Green Leaves And Beads Phone Charm,2.51,37,0,Others,Green Leaves And Beads Phone Charm
Purple Leaves And Beads Phone Char,2.51,35,0,Others,Purple Leaves And Beads Phone Char
Ant Copper Lime Boudicca Bracelet,5.09,35,0,Others,Ant Copper Lime Boudicca Bracelet
Butterfly Hair Band,2.54,9,0,Others,Butterfly Hair Band
Drop Earrings W Flower & Leaf,2.54,29,0,Others,Drop Earrings W Flower & Leaf
"Letter ""O"" Bling Key Ring",0.85,24,0,Others,"Letter ""O"" Bling Key Ring"
Sunjar Led Night Night Light,16.13,16,0,Others,Sunjar Led Night Night Light
Medium Chinese Style Scissor,0.5,11,0,Others,Medium Chinese Style Scissor
Small Folding Scissor(Pointed Edge),0.25,7,0,Others,Small Folding Scissor(Pointed Edge)
Blue Breakfast Cup And Saucer,2.95,8,0,Kitchen,Blue Breakfast Cup And Saucer
"Retro ""Tea For One""",4.95,36,0,Kitchen,"Retro ""Tea For One"""
Garden Path Notebook,1.65,8,0,Others,Garden Path Notebook
Abstract Circles Pocket Book,0.85,15,0,Others,Abstract Circles Pocket Book
Red Retrospot Small Milk Jug,2.55,40,0,Others,Red Retrospot Small Milk Jug
Hairclips Forties Fabric Assorted,0.65,25,0,Others,Hairclips Forties Fabric Assorted
3 Tier Sweetheart Garden Shelf,35.95,7,0,Decoration,3 Tier Sweetheart Garden Shelf
Silver Standing Gnome,4.25,26,0,Others,Silver Standing Gnome
Danish Rose Photo Frame,2.55,33,0,Others,Danish Rose Photo Frame
Ivory Shell Heart Earrings,2.55,36,0,Decoration,Ivory Shell Heart Earrings
White Soap Rack With 2 Bottles,5.95,14,0,Others,White Soap Rack With 2 Bottles
Pink Poodle Hanging Decoration,3.36,24,0,Others,Pink Poodle Hanging Decoration
Glass Sphere Candle Stand Medium,11.02,29,0,Decoration,Glass Sphere Candle Stand Medium
3 Wick Christmas Briar Candle,8.47,35,0,Decoration,3 Wick Christmas Briar Candle
Set Of 16 Vintage Black Cutlery,25.49,35,0,Others,Set Of 16 Vintage Black Cutlery
Number Tile Vintage Font 6,4.21,29,0,Others,Number Tile Vintage Font 6
Black Stitched Wall Clock,7.62,9,0,Others,Black Stitched Wall Clock
Pompom Curtain,6.95,27,0,Others,Pompom Curtain
English Rose Small Scented Flower,0.85,6,0,Others,English Rose Small Scented Flower
Hawaiian Grass Skirt,1.25,7,0,Others,Hawaiian Grass Skirt
Assorted Easter Decorations Bells,1.25,10,0,Others,Assorted Easter Decorations Bells
Baking Mould Easter Egg White Choc,2.95,26,0,Others,Baking Mould Easter Egg White Choc
Teatime Round Pencil Sharpener,0.85,25,0,Kitchen,Teatime Round Pencil Sharpener
Pink Pot Plant Candle,7.62,11,0,Decoration,Pink Pot Plant Candle
Felt Egg Cosy Ladybird,1.66,17,0,Others,Felt Egg Cosy Ladybird
Woven Rose Garden Cushion Cover,4.21,9,0,Others,Woven Rose Garden Cushion Cover
Set Of 4 Carousel Placemats,7.62,27,0,Others,Set Of 4 Carousel Placemats
Set Of 4 Green Carousel Coasters,2.51,5,0,Others,Set Of 4 Green Carousel Coasters
Folk Felt Hanging Multicol Garland,7.62,36,0,Others,Folk Felt Hanging Multicol Garland
Ruby Glass Cluster Bracelet,6.37,35,0,Others,Ruby Glass Cluster Bracelet
Chunky Silver Necklace Pastel Flowe,10.62,12,0,Others,Chunky Silver Necklace Pastel Flowe
Red Enamel Flower Ring,2.96,14,0,Others,Red Enamel Flower Ring
Set/4 Colourful Mixing Bowls,9.95,14,0,Others,Set/4 Colourful Mixing Bowls
Set Of 4 Pistachio Lovebird Coaster,2.55,30,0,Others,Set Of 4 Pistachio Lovebird Coaster
Set Of 4 Black Lovebird Coasters,2.55,13,0,Others,Set Of 4 Black Lovebird Coasters
Empire Design Rosette,1.25,19,0,Others,Empire Design Rosette
Gold Standing Gnome,3.75,30,0,Others,Gold Standing Gnome
First Class Luggage Tag,1.25,8,0,Others,First Class Luggage Tag
Ass Col Large Sand Frog P'Weight,1.05,20,0,Others,Ass Col Large Sand Frog P'Weight
Hanging Chick Cream Decoration,1.45,19,0,Others,Hanging Chick Cream Decoration
Blue Polkadot Garden Parasol,7.95,37,0,Others,Blue Polkadot Garden Parasol
Silver Fabric Mirror,1.25,40,0,Others,Silver Fabric Mirror
Danish Rose Trinket Trays,5.95,29,0,Others,Danish Rose Trinket Trays
Set 4 Nursery Des Round Boxes,2.95,15,0,Accessories,Set 4 Nursery Des Round Boxes
Danish Rose Deluxe Coaster,0.85,32,0,Others,Danish Rose Deluxe Coaster
Small Kitchen Flower Pots Plaque,6.95,35,0,Others,Small Kitchen Flower Pots Plaque
Bunny Wooden Painted With Flower,0.85,35,0,Others,Bunny Wooden Painted With Flower
Bunny Wooden Painted With Bird,0.85,27,0,Others,Bunny Wooden Painted With Bird
Wrap Green Russian Folkart,0.42,6,0,Others,Wrap Green Russian Folkart
Popart Rect Pencil Sharpener Asst,0.42,34,0,Others,Popart Rect Pencil Sharpener Asst
Large Tortilla Design Red Bowl,3.75,14,0,Others,Large Tortilla Design Red Bowl
Blue Knitted Hen,1.65,23,0,Others,Blue Knitted Hen
Candy Spot Heart Decoration,0.85,16,0,Decoration,Candy Spot Heart Decoration
Flower Purple Clock W/Sucker,0.85,7,0,Others,Flower Purple Clock W/Sucker
Mini Cake Stand Hanging Strawbery,1.45,18,0,Others,Mini Cake Stand Hanging Strawbery
Fruit Tree And Birds Wall Plaque,7.95,15,0,Others,Fruit Tree And Birds Wall Plaque
Sprig Lavender Artificial Flower,0.42,27,0,Others,Sprig Lavender Artificial Flower
Set Of 3 Pink Flying Ducks,5.45,31,0,Others,Set Of 3 Pink Flying Ducks
Painted Pink Rabbit,0.85,29,0,Others,Painted Pink Rabbit
Pink Polkadot Garden Parasol,7.95,23,0,Others,Pink Polkadot Garden Parasol
Paperweight Home Sweet Home,2.55,13,0,Others,Paperweight Home Sweet Home
Glass Chalice Blue Small,3.36,21,0,Others,Glass Chalice Blue Small
Starfish Soap Dish,5.06,39,0,Others,Starfish Soap Dish
Oyster Trinket Box,6.77,24,0,Accessories,Oyster Trinket Box
"Decoration , Wobbly Rabbit , Metal",3.36,29,0,Others,"Decoration , Wobbly Rabbit , Metal"
"Decoration , Wobbly Chicken, Metal",3.36,17,0,Others,"Decoration , Wobbly Chicken, Metal"
Pink Feather Christmas Decoration,2.51,9,0,Others,Pink Feather Christmas Decoration
White Christmas Flock Droplet,2.51,31,0,Others,White Christmas Flock Droplet
Woven Sunset Cushion Cover,4.21,27,0,Others,Woven Sunset Cushion Cover
Beach Hut Design Blackboard,8.47,27,0,Others,Beach Hut Design Blackboard
Pink Scottie Dog W Flower Pattern,5.06,7,0,Others,Pink Scottie Dog W Flower Pattern
S/4 Groovy Cat Magnets,3.36,9,0,Others,S/4 Groovy Cat Magnets
Bili Nut And Wood Necklace,5.94,9,0,Others,Bili Nut And Wood Necklace
Murano Style Glass Bracelet Red,4.24,8,0,Others,Murano Style Glass Bracelet Red
Aqua Bertie Glass Bead Bag Charm,4.21,24,0,Accessories,Aqua Bertie Glass Bead Bag Charm
Purple Bertie Glass Bead Bag Charm,4.21,26,0,Accessories,Purple Bertie Glass Bead Bag Charm
Boxed Glass Ashtray,2.51,28,0,Accessories,Boxed Glass Ashtray
Strawbry Scented Votive Candle,0.29,11,0,Decoration,Strawbry Scented Votive Candle
Love Seat Antique White Metal,175.0,29,0,Others,Love Seat Antique White Metal
Dog Bowl Vintage Cream,4.25,18,0,Others,Dog Bowl Vintage Cream
Mirror Mosaic T-Light Holder,1.65,22,0,Others,Mirror Mosaic T-Light Holder
Mini Highlighter Pens,0.12,24,0,Others,Mini Highlighter Pens
Silver Photo Frame,2.1,32,0,Others,Silver Photo Frame
Gold Photo Frame,2.1,23,0,Others,Gold Photo Frame
Crystal Pair Heart Hair Slides,3.75,23,0,Decoration,Crystal Pair Heart Hair Slides
Pink Vintage Victorian Earrings,2.95,6,0,Others,Pink Vintage Victorian Earrings
Small Tall Camphor Wood Toadstool,1.65,38,0,Others,Small Tall Camphor Wood Toadstool
Assorted Easter Gift Tags,0.85,22,0,Others,Assorted Easter Gift Tags
Easter Tin Keepsake,1.65,34,0,Others,Easter Tin Keepsake
Easter Tin Chicks In Garden,1.65,18,0,Others,Easter Tin Chicks In Garden
Jigsaw Tree With Watering Can,0.85,28,0,Others,Jigsaw Tree With Watering Can
Jigsaw Toadstools 3 Piece,1.65,24,0,Others,Jigsaw Toadstools 3 Piece
Blue Tiled Tray,6.75,21,0,Others,Blue Tiled Tray
Tropical Holiday Purse,2.95,17,0,Others,Tropical Holiday Purse
Carousel Ponies Baby Bib,1.25,15,0,Others,Carousel Ponies Baby Bib
Vip Holiday Purse,2.95,13,0,Others,Vip Holiday Purse
Party Time Design Flannel,0.85,10,0,Others,Party Time Design Flannel
Economy Holiday Purse,2.95,19,0,Others,Economy Holiday Purse
Old Doc Russel Metal Sign,2.1,32,0,Others,Old Doc Russel Metal Sign
Blue Shark Helicopter,7.95,10,0,Others,Blue Shark Helicopter
Green Wire Standing Candle Holder,3.75,13,0,Decoration,Green Wire Standing Candle Holder
Letter Shape Pencil Sharpener,0.16,5,0,Others,Letter Shape Pencil Sharpener
Door Hanger Mum + Dads Room,1.45,11,0,Others,Door Hanger Mum + Dads Room
Gold Scroll Glass T-Light Holder,2.1,25,0,Others,Gold Scroll Glass T-Light Holder
Pink Butterfly Washbag,4.25,5,0,Accessories,Pink Butterfly Washbag
"Flower Glass Garld Neckl36""Amethyst",7.95,25,0,Others,"Flower Glass Garld Neckl36""Amethyst"
Purple Boudicca Large Bracelet,6.95,26,0,Others,Purple Boudicca Large Bracelet
Red Boudicca Large Bracelet,6.95,7,0,Others,Red Boudicca Large Bracelet
Pink Boudicca Large Bracelet,6.95,16,0,Others,Pink Boudicca Large Bracelet
"Bathroom Scales, Tropical Beach",3.75,8,0,Others,"Bathroom Scales, Tropical Beach"
Charlie & Lola Wastepaper Bin Blue,3.75,25,0,Others,Charlie & Lola Wastepaper Bin Blue
Pink Honeycomb Paper Fan,4.21,30,0,Others,Pink Honeycomb Paper Fan
Set Of 36 Dinosaur Paper Doilies,2.98,34,0,Others,Set Of 36 Dinosaur Paper Doilies
Easter Tree Yellow Birds,12.72,15,0,Others,Easter Tree Yellow Birds
Number Tile Vintage Font 8,4.21,36,0,Others,Number Tile Vintage Font 8
Green Heart Compact Mirror,7.62,33,0,Decoration,Green Heart Compact Mirror
Pink Bertie Mobile Phone Charm,3.36,40,0,Others,Pink Bertie Mobile Phone Charm
Gold/Amber Drop Earrings W Leaf,2.96,8,0,Others,Gold/Amber Drop Earrings W Leaf
Black Christmas Flock Droplet,1.25,5,0,Others,Black Christmas Flock Droplet
Flowers Tile Hook,2.1,21,0,Others,Flowers Tile Hook
Danish Rose Bedside Cabinet,39.95,24,0,Others,Danish Rose Bedside Cabinet
White Murano Twist Bracelet,4.25,5,0,Others,White Murano Twist Bracelet
Hanging Metal Chicken Decoration,2.51,36,0,Others,Hanging Metal Chicken Decoration
Mr Robot Soft Toy,14.43,11,0,Toys,Mr Robot Soft Toy
Gold Teddy Bear,7.62,26,0,Others,Gold Teddy Bear
Pink Heart Confetti In Tube,3.36,22,0,Decoration,Pink Heart Confetti In Tube
Mirrored Dove Wall Decoration,4.21,14,0,Others,Mirrored Dove Wall Decoration
Cd Wall Tidy Blue Office,0.84,15,0,Others,Cd Wall Tidy Blue Office
Pink Gingham Cat With Scarf,5.06,13,0,Others,Pink Gingham Cat With Scarf
Pink Bitty Light Chain,9.32,37,0,Others,Pink Bitty Light Chain
Pink Metal Swinging Bunny,1.66,40,0,Others,Pink Metal Swinging Bunny
Montana Diamond Cluster Earrings,2.96,18,0,Others,Montana Diamond Cluster Earrings
Pink Rosebud Pearl Bracelet,7.64,28,0,Others,Pink Rosebud Pearl Bracelet
White Rosebud Pearl Bracelet,7.64,29,0,Others,White Rosebud Pearl Bracelet
Black Silouette Candle Plate,0.85,5,0,Decoration,Black Silouette Candle Plate
Hen Party Cordon Barrier Tape,1.25,7,0,Others,Hen Party Cordon Barrier Tape
Empire Gift Wrap,0.42,15,0,Others,Empire Gift Wrap
Candle Plate Lace White,2.55,36,0,Decoration,Candle Plate Lace White
Ant Silver Fuschia Boudicca Ring,2.95,7,0,Others,Ant Silver Fuschia Boudicca Ring
