Product Name,Price,Stock,Discount,Category,Description
White Hanging Heart T-Light Holder,2.55,34,0,Decoration,White Hanging Heart T-Light Holder
White Metal Lantern,3.39,23,0,Decoration,White Metal Lantern
Cream Cupid Hearts Coat Hanger,2.75,10,0,Kitchen,Cream Cupid Hearts Coat Hanger
Knitted Union Flag Hot Water Bottle,3.39,16,0,Others,Knitted Union Flag Hot Water Bottle
Red Woolly Hottie White Heart.,3.39,34,0,Decoration,Red Woolly Hottie White Heart.
Set 7 Babushka Nesting Boxes,7.65,20,0,Accessories,Set 7 Babushka Nesting Boxes
Glass Star Frosted T-Light Holder,4.25,37,0,Others,Glass Star Frosted T-Light Holder
Hand Warmer Union Jack,1.85,5,0,Others,Hand Warmer Union Jack
Hand Warmer Red Polka Dot,1.85,38,0,Others,Hand Warmer Red Polka Dot
Assorted Colour Bird Ornament,1.69,14,0,Others,Assorted Colour Bird Ornament
Poppy'S Playhouse Bedroom,2.1,12,0,Others,Poppy'S Playhouse Bedroom
Poppy'S Playhouse Kitchen,2.1,18,0,Others,Poppy'S Playhouse Kitchen
Feltcraft Princess Charlotte Doll,3.75,10,0,Toys,Feltcraft Princess Charlotte Doll
Ivory Knitted Mug Cosy,1.65,25,0,Kitchen,Ivory Knitted Mug Cosy
Box Of 6 Assorted Colour Teaspoons,4.25,14,0,Kitchen,Box Of 6 Assorted Colour Teaspoons
Box Of Vintage Jigsaw Blocks,4.95,30,0,Accessories,Box Of Vintage Jigsaw Blocks
Box Of Vintage Alphabet Blocks,9.95,11,0,Accessories,Box Of Vintage Alphabet Blocks
Home Building Block Word,5.95,35,0,Others,Home Building Block Word
Love Building Block Word,5.95,34,0,Others,Love Building Block Word
Recipe Box With Metal Heart,7.95,27,0,Decoration,Recipe Box With Metal Heart
Doormat New England,7.95,20,0,Others,Doormat New England
Jam Making Set With Jars,4.25,7,0,Others,Jam Making Set With Jars
Red Coat Rack Paris Fashion,4.95,23,0,Others,Red Coat Rack Paris Fashion
Yellow Coat Rack Paris Fashion,4.95,39,0,Others,Yellow Coat Rack Paris Fashion
Blue Coat Rack Paris Fashion,4.95,27,0,Others,Blue Coat Rack Paris Fashion
Bath Building Block Word,5.95,24,0,Others,Bath Building Block Word
Alarm Clock Bakelike Pink,3.75,22,0,Others,Alarm Clock Bakelike Pink
Alarm Clock Bakelike Red,3.75,7,0,Others,Alarm Clock Bakelike Red
Alarm Clock Bakelike Green,3.75,17,0,Others,Alarm Clock Bakelike Green
Panda And Bunnies Sticker Sheet,0.85,33,0,Others,Panda And Bunnies Sticker Sheet
Stars Gift Tape,0.65,23,0,Others,Stars Gift Tape
Inflatable Political Globe,0.85,20,0,Others,Inflatable Political Globe
Vintage Heads And Tails Card Game,1.25,9,0,Others,Vintage Heads And Tails Card Game
Set/2 Red Retrospot Tea Towels,2.95,24,0,Kitchen,Set/2 Red Retrospot Tea Towels
Round Snack Boxes Set Of4 Woodland,2.95,17,0,Accessories,Round Snack Boxes Set Of4 Woodland
Spaceboy Lunch Box,1.95,34,0,Accessories,Spaceboy Lunch Box
Lunch Box I Love London,1.95,24,0,Accessories,Lunch Box I Love London
Circus Parade Lunch Box,1.95,14,0,Accessories,Circus Parade Lunch Box
Charlotte Bag Dolly Girl Design,0.85,24,0,Toys,Charlotte Bag Dolly Girl Design
Red Toadstool Led Night Light,1.65,40,0,Others,Red Toadstool Led Night Light
Set 2 Tea Towels I Love London,2.95,29,0,Kitchen,Set 2 Tea Towels I Love London
Vintage Seaside Jigsaw Puzzles,3.75,21,0,Others,Vintage Seaside Jigsaw Puzzles
Mini Jigsaw Circus Parade,0.42,29,0,Others,Mini Jigsaw Circus Parade
Mini Jigsaw Spaceboy,0.42,22,0,Others,Mini Jigsaw Spaceboy
Mini Paint Set Vintage,0.65,33,0,Others,Mini Paint Set Vintage
Paper Chain Kit 50'S Christmas,2.55,34,0,Others,Paper Chain Kit 50'S Christmas
Edwardian Parasol Red,4.95,14,0,Others,Edwardian Parasol Red
Save The Planet Mug,1.06,16,0,Kitchen,Save The Planet Mug
Vintage Billboard Drink Me Mug,1.06,19,0,Kitchen,Vintage Billboard Drink Me Mug
Vintage Billboard Love/Hate Mug,1.06,25,0,Kitchen,Vintage Billboard Love/Hate Mug
Wood 2 Drawer Cabinet White Finish,4.95,26,0,Others,Wood 2 Drawer Cabinet White Finish
Wood S/3 Cabinet Ant White Finish,6.95,27,0,Others,Wood S/3 Cabinet Ant White Finish
Wooden Picture Frame White Finish,2.1,13,0,Others,Wooden Picture Frame White Finish
Wooden Frame Antique White,2.55,13,0,Others,Wooden Frame Antique White
Victorian Sewing Box Large,10.95,27,0,Accessories,Victorian Sewing Box Large
Hot Water Bottle Tea And Sympathy,3.45,9,0,Kitchen,Hot Water Bottle Tea And Sympathy
Red Hanging Heart T-Light Holder,2.55,16,0,Decoration,Red Hanging Heart T-Light Holder
Jumbo Bag Pink Polkadot,1.95,37,0,Accessories,Jumbo Bag Pink Polkadot
Jumbo Bag Baroque Black White,1.95,35,0,Accessories,Jumbo Bag Baroque Black White
Jumbo Bag Charlie And Lola Toys,2.95,5,0,Toys,Jumbo Bag Charlie And Lola Toys
Strawberry Charlotte Bag,0.85,10,0,Accessories,Strawberry Charlotte Bag
Red 3 Piece Retrospot Cutlery Set,3.75,25,0,Others,Red 3 Piece Retrospot Cutlery Set
Blue 3 Piece Polkadot Cutlery Set,3.75,9,0,Others,Blue 3 Piece Polkadot Cutlery Set
Set/6 Red Spotty Paper Plates,0.85,25,0,Others,Set/6 Red Spotty Paper Plates
Lunch Bag Red Retrospot,1.65,7,0,Accessories,Lunch Bag Red Retrospot
Strawberry Lunch Box With Cutlery,2.55,23,0,Accessories,Strawberry Lunch Box With Cutlery
Lunch Box With Cutlery Retrospot,2.55,35,0,Accessories,Lunch Box With Cutlery Retrospot
Pack Of 72 Retrospot Cake Cases,0.42,34,0,Others,Pack Of 72 Retrospot Cake Cases
Pack Of 60 Dinosaur Cake Cases,0.55,8,0,Others,Pack Of 60 Dinosaur Cake Cases
Pack Of 60 Pink Paisley Cake Cases,0.55,21,0,Others,Pack Of 60 Pink Paisley Cake Cases
60 Teatime Fairy Cake Cases,0.55,10,0,Kitchen,60 Teatime Fairy Cake Cases
Tomato Charlie+Lola Coaster Set,2.95,39,0,Others,Tomato Charlie+Lola Coaster Set
Charlie & Lola Wastepaper Bin Flora,1.25,36,0,Others,Charlie & Lola Wastepaper Bin Flora
Red Charlie+Lola Personal Doorsign,0.38,25,0,Others,Red Charlie+Lola Personal Doorsign
Jumbo Storage Bag Suki,1.95,17,0,Accessories,Jumbo Storage Bag Suki
Jumbo Bag Pink Vintage Paisley,1.95,28,0,Accessories,Jumbo Bag Pink Vintage Paisley
Jam Making Set Printed,1.45,40,0,Others,Jam Making Set Printed
Retrospot Tea Set Ceramic 11 Pc,4.25,31,0,Kitchen,Retrospot Tea Set Ceramic 11 Pc
Girly Pink Tool Set,4.95,31,0,Others,Girly Pink Tool Set
Jumbo Shopper Vintage Red Paisley,1.95,22,0,Others,Jumbo Shopper Vintage Red Paisley
"Airline Lounge,Metal Sign",2.1,36,0,Others,"Airline Lounge,Metal Sign"
White Spot Red Ceramic Drawer Knob,1.25,19,0,Others,White Spot Red Ceramic Drawer Knob
Red Drawer Knob Acrylic Edwardian,1.25,11,0,Others,Red Drawer Knob Acrylic Edwardian
Clear Drawer Knob Acrylic Edwardian,1.25,17,0,Others,Clear Drawer Knob Acrylic Edwardian
Photo Clip Line,1.25,24,0,Others,Photo Clip Line
Felt Egg Cosy Chicken,0.85,34,0,Others,Felt Egg Cosy Chicken
Skull Shoulder Bag,1.65,23,0,Accessories,Skull Shoulder Bag
You'Re Confusing Me Metal Sign,1.69,6,0,Others,You'Re Confusing Me Metal Sign
Cook With Wine Metal Sign,1.95,5,0,Others,Cook With Wine Metal Sign
Gin + Tonic Diet Metal Sign,2.1,25,0,Others,Gin + Tonic Diet Metal Sign
Yellow Breakfast Cup And Saucer,2.95,20,0,Kitchen,Yellow Breakfast Cup And Saucer
Pink Breakfast Cup And Saucer,2.95,24,0,Kitchen,Pink Breakfast Cup And Saucer
Paper Chain Kit Retrospot,2.95,39,0,Others,Paper Chain Kit Retrospot
Small Heart Flowers Hook,0.85,7,0,Decoration,Small Heart Flowers Hook
Tea Time Des Tea Cosy,2.55,10,0,Kitchen,Tea Time Des Tea Cosy
Felt Egg Cosy White Rabbit,0.85,35,0,Others,Felt Egg Cosy White Rabbit
Zinc Willie Winkie Candle Stick,0.85,13,0,Decoration,Zinc Willie Winkie Candle Stick
Retrospot Large Milk Jug,4.95,33,0,Others,Retrospot Large Milk Jug
Set Of 6 Funky Beakers,2.95,8,0,Others,Set Of 6 Funky Beakers
Edwardian Parasol Black,5.95,39,0,Others,Edwardian Parasol Black
Edwardian Parasol Natural,5.95,6,0,Others,Edwardian Parasol Natural
Blue Owl Soft Toy,2.95,26,0,Toys,Blue Owl Soft Toy
Balloon Art Make Your Own Flowers,1.95,31,0,Others,Balloon Art Make Your Own Flowers
Glass Cloche Small,3.95,38,0,Others,Glass Cloche Small
Gumball Monochrome Coat Rack,1.06,31,0,Others,Gumball Monochrome Coat Rack
Doormat Fancy Font Home Sweet Home,6.75,35,0,Others,Doormat Fancy Font Home Sweet Home
Vintage Snakes & Ladders,3.75,5,0,Others,Vintage Snakes & Ladders
Chocolate Calculator,1.65,9,0,Others,Chocolate Calculator
Recycling Bag Retrospot,2.1,6,0,Accessories,Recycling Bag Retrospot
Toy Tidy Pink Polkadot,1.85,9,0,Toys,Toy Tidy Pink Polkadot
Antique Glass Dressing Table Pot,2.95,23,0,Others,Antique Glass Dressing Table Pot
Ivory Giant Garden Thermometer,5.95,17,0,Others,Ivory Giant Garden Thermometer
3 Tier Cake Tin Green And Cream,14.95,12,0,Others,3 Tier Cake Tin Green And Cream
3 Tier Cake Tin Red And Cream,14.95,12,0,Others,3 Tier Cake Tin Red And Cream
Set 3 Wicker Oval Baskets W Lids,16.95,15,0,Others,Set 3 Wicker Oval Baskets W Lids
Wood Black Board Ant White Finish,6.45,12,0,Others,Wood Black Board Ant White Finish
Colour Glass T-Light Holder Hanging,0.65,9,0,Others,Colour Glass T-Light Holder Hanging
Hanging Metal Heart Lantern,1.65,25,0,Decoration,Hanging Metal Heart Lantern
Hanging Medina Lantern Small,2.95,27,0,Decoration,Hanging Medina Lantern Small
Natural Slate Heart Chalkboard,2.95,5,0,Decoration,Natural Slate Heart Chalkboard
Heart Of Wicker Small,1.45,15,0,Decoration,Heart Of Wicker Small
Heart Of Wicker Large,2.55,5,0,Decoration,Heart Of Wicker Large
White Lovebird Lantern,2.95,32,0,Decoration,White Lovebird Lantern
Classic Metal Birdcage Plant Holder,12.75,19,0,Others,Classic Metal Birdcage Plant Holder
Cream Heart Card Holder,3.95,11,0,Decoration,Cream Heart Card Holder
Enamel Flower Jug Cream,5.95,8,0,Others,Enamel Flower Jug Cream
Enamel Fire Bucket Cream,6.95,7,0,Others,Enamel Fire Bucket Cream
Enamel Bread Bin Cream,10.95,15,0,Others,Enamel Bread Bin Cream
Jumbo Bag Dolly Girl Design,1.95,11,0,Toys,Jumbo Bag Dolly Girl Design
Traditional Christmas Ribbons,1.25,20,0,Others,Traditional Christmas Ribbons
Organiser Wood Antique White,8.5,14,0,Others,Organiser Wood Antique White
Lunch Bag Dolly Girl Design,1.65,15,0,Toys,Lunch Bag Dolly Girl Design
White Wire Egg Holder,4.95,16,0,Others,White Wire Egg Holder
Jumbo Bag Red Retrospot,1.65,7,0,Accessories,Jumbo Bag Red Retrospot
Chilli Lights,3.82,7,0,Others,Chilli Lights
Light Garland Butterfiles Pink,3.37,37,0,Others,Light Garland Butterfiles Pink
Wooden Owls Light Garland,3.37,8,0,Others,Wooden Owls Light Garland
Fairy Tale Cottage Nightlight,1.45,31,0,Others,Fairy Tale Cottage Nightlight
Home Small Wood Letters,4.95,16,0,Others,Home Small Wood Letters
Gingham Heart Doorstop Red,4.25,8,0,Decoration,Gingham Heart Doorstop Red
Five Heart Hanging Decoration,2.95,13,0,Decoration,Five Heart Hanging Decoration
Assorted Bottle Top Magnets,0.42,20,0,Others,Assorted Bottle Top Magnets
Fridge Magnets Us Diner Assorted,0.85,14,0,Others,Fridge Magnets Us Diner Assorted
Homemade Jam Scented Candles,1.45,35,0,Decoration,Homemade Jam Scented Candles
Fridge Magnets Les Enfants Assorted,0.85,23,0,Others,Fridge Magnets Les Enfants Assorted
Rose Caravan Doorstop,6.75,38,0,Others,Rose Caravan Doorstop
5 Hook Hanger Magic Toadstool,1.65,30,0,Others,5 Hook Hanger Magic Toadstool
Christmas Lights 10 Reindeer,8.5,28,0,Others,Christmas Lights 10 Reindeer
Vintage Union Jack Cushion Cover,4.95,33,0,Others,Vintage Union Jack Cushion Cover
Set Of 3 Coloured Flying Ducks,5.45,28,0,Others,Set Of 3 Coloured Flying Ducks
Set Of 3 Gold Flying Ducks,6.35,13,0,Others,Set Of 3 Gold Flying Ducks
Red Retrospot Umbrella,5.95,31,0,Others,Red Retrospot Umbrella
Black/Blue Polkadot Umbrella,5.95,19,0,Others,Black/Blue Polkadot Umbrella
Red Diner Wall Clock,8.5,15,0,Others,Red Diner Wall Clock
Blue Diner Wall Clock,8.5,5,0,Others,Blue Diner Wall Clock
Ivory Diner Wall Clock,8.5,21,0,Others,Ivory Diner Wall Clock
Large Heart Measuring Spoons,1.65,19,0,Decoration,Large Heart Measuring Spoons
Small Heart Measuring Spoons,0.85,7,0,Decoration,Small Heart Measuring Spoons
Jam Jar With Pink Lid,0.72,38,0,Others,Jam Jar With Pink Lid
Jam Jar With Green Lid,0.72,5,0,Others,Jam Jar With Green Lid
Rose Cottage Keepsake Box,8.5,16,0,Accessories,Rose Cottage Keepsake Box
Hanging Heart Zinc T-Light Holder,0.64,11,0,Decoration,Hanging Heart Zinc T-Light Holder
Paper Chain Kit Vintage Christmas,2.55,26,0,Others,Paper Chain Kit Vintage Christmas
Disco Ball Christmas Decoration,0.1,39,0,Others,Disco Ball Christmas Decoration
Small Popcorn Holder,0.72,37,0,Others,Small Popcorn Holder
Large Popcorn Holder,1.45,22,0,Others,Large Popcorn Holder
Set/20 Red Retrospot Paper Napkins,0.64,14,0,Others,Set/20 Red Retrospot Paper Napkins
Set/6 Red Spotty Paper Cups,0.65,34,0,Kitchen,Set/6 Red Spotty Paper Cups
Polkadot Rain Hat,0.32,21,0,Others,Polkadot Rain Hat
Deluxe Sewing Kit,4.95,21,0,Others,Deluxe Sewing Kit
Retrospot Heart Hot Water Bottle,4.25,19,0,Decoration,Retrospot Heart Hot Water Bottle
English Rose Hot Water Bottle,3.75,30,0,Others,English Rose Hot Water Bottle
Photo Cube,1.48,19,0,Others,Photo Cube
3 Stripey Mice Feltcraft,1.95,11,0,Others,3 Stripey Mice Feltcraft
Set Of 6 Soldier Skittles,3.75,6,0,Others,Set Of 6 Soldier Skittles
Traditional Wooden Skipping Rope,1.25,13,0,Others,Traditional Wooden Skipping Rope
Wooden Box Of Dominoes,1.25,7,0,Accessories,Wooden Box Of Dominoes
Rustic Seventeen Drawer Sideboard,165.0,10,0,Others,Rustic Seventeen Drawer Sideboard
Party Cones Carnival Assorted,1.25,17,0,Others,Party Cones Carnival Assorted
Party Cones Candy Assorted,1.25,28,0,Others,Party Cones Candy Assorted
Picnic Basket Wicker Small,5.95,34,0,Others,Picnic Basket Wicker Small
Star Decoration Painted Zinc,0.65,15,0,Others,Star Decoration Painted Zinc
Retrospot Lamp,9.95,32,0,Others,Retrospot Lamp
"Fancy Font Birthday Card,",0.42,14,0,Others,"Fancy Font Birthday Card,"
Hand Warmer Scotty Dog Design,1.85,38,0,Others,Hand Warmer Scotty Dog Design
Hand Warmer Owl Design,1.85,23,0,Others,Hand Warmer Owl Design
Hand Warmer Red Retrospot,1.85,13,0,Others,Hand Warmer Red Retrospot
Dog Bowl Chasing Ball Design,3.75,16,0,Others,Dog Bowl Chasing Ball Design
Clothes Pegs Retrospot Pack 24,1.25,16,0,Others,Clothes Pegs Retrospot Pack 24
Hand Over The Chocolate Sign,2.1,12,0,Others,Hand Over The Chocolate Sign
Travel Sewing Kit,1.65,25,0,Others,Travel Sewing Kit
Black Heart Card Holder,3.95,17,0,Decoration,Black Heart Card Holder
Chick Grey Hot Water Bottle,3.45,39,0,Others,Chick Grey Hot Water Bottle
Small Glass Heart Trinket Pot,2.1,22,0,Decoration,Small Glass Heart Trinket Pot
Alarm Clock Bakelike Ivory,3.75,21,0,Others,Alarm Clock Bakelike Ivory
Alarm Clock Bakelike Orange,3.75,24,0,Others,Alarm Clock Bakelike Orange
Hand Warmer Bird Design,2.1,25,0,Others,Hand Warmer Bird Design
Ivory Embroidered Quilt,35.75,14,0,Others,Ivory Embroidered Quilt
Set Of 3 Black Flying Ducks,4.65,40,0,Others,Set Of 3 Black Flying Ducks
Pack Of 12 Red Retrospot Tissues,0.29,34,0,Others,Pack Of 12 Red Retrospot Tissues
Red Retrospot Mug,2.95,30,0,Kitchen,Red Retrospot Mug
Babushka Lights String Of 10,6.75,5,0,Others,Babushka Lights String Of 10
Doormat Fairy Cake,7.95,31,0,Others,Doormat Fairy Cake
Strawberry Ceramic Trinket Box,1.25,13,0,Accessories,Strawberry Ceramic Trinket Box
Pink Doughnut Trinket Pot,1.65,13,0,Others,Pink Doughnut Trinket Pot
Silk Purse Babushka Pink,3.35,38,0,Others,Silk Purse Babushka Pink
Hot Water Bottle I Am So Poorly,4.65,28,0,Others,Hot Water Bottle I Am So Poorly
Chocolate Hot Water Bottle,4.95,7,0,Others,Chocolate Hot Water Bottle
White Skull Hot Water Bottle,3.75,13,0,Others,White Skull Hot Water Bottle
Scottie Dog Hot Water Bottle,4.95,13,0,Others,Scottie Dog Hot Water Bottle
Bird House Hot Water Bottle,2.55,24,0,Others,Bird House Hot Water Bottle
Boudoir Square Tissue Box,1.25,15,0,Accessories,Boudoir Square Tissue Box
Skulls Square Tissue Box,1.25,8,0,Accessories,Skulls Square Tissue Box
Photo Frame Cornice,2.95,23,0,Others,Photo Frame Cornice
Silk Purse Babushka Red,3.35,29,0,Others,Silk Purse Babushka Red
Picture Dominoes,1.45,20,0,Others,Picture Dominoes
S/6 Sew On Crochet Flowers,1.25,29,0,Others,S/6 Sew On Crochet Flowers
Scandinavian Reds Ribbons,1.25,17,0,Others,Scandinavian Reds Ribbons
Balloons Writing Set,1.65,17,0,Others,Balloons Writing Set
Lavender Incense In Tin,1.25,13,0,Others,Lavender Incense In Tin
Tv Dinner Tray Vintage Paisley,4.95,6,0,Others,Tv Dinner Tray Vintage Paisley
Set Of 4 English Rose Placemats,3.75,22,0,Others,Set Of 4 English Rose Placemats
Set Of 4 English Rose Coasters,1.25,22,0,Others,Set Of 4 English Rose Coasters
Triple Photo Frame Cornice,9.95,32,0,Others,Triple Photo Frame Cornice
Family Photo Frame Cornice,9.95,14,0,Others,Family Photo Frame Cornice
Mirrored Disco Ball,5.95,30,0,Others,Mirrored Disco Ball
Disco Ball Rotator Battery Operated,4.25,24,0,Others,Disco Ball Rotator Battery Operated
Silver Looking Mirror,4.95,39,0,Others,Silver Looking Mirror
Ladies & Gentlemen Metal Sign,2.55,16,0,Others,Ladies & Gentlemen Metal Sign
Metal Sign Her Dinner Is Served,2.95,23,0,Others,Metal Sign Her Dinner Is Served
Doormat Topiary,7.95,14,0,Others,Doormat Topiary
Bathroom Metal Sign,0.55,21,0,Others,Bathroom Metal Sign
Kitchen Metal Sign,0.55,39,0,Others,Kitchen Metal Sign
Toilet Metal Sign,0.55,26,0,Others,Toilet Metal Sign
Metal Sign Take It Or Leave It,2.95,38,0,Others,Metal Sign Take It Or Leave It
I'M On Holiday Metal Sign,2.1,33,0,Others,I'M On Holiday Metal Sign
Grow Your Own Basil In Enamel Mug,2.1,11,0,Kitchen,Grow Your Own Basil In Enamel Mug
Set/10 Pink Polkadot Party Candles,1.25,33,0,Decoration,Set/10 Pink Polkadot Party Candles
Set 20 Napkins Fairy Cakes Design,0.85,32,0,Others,Set 20 Napkins Fairy Cakes Design
Set Of 6 T-Lights Snowmen,2.95,33,0,Others,Set Of 6 T-Lights Snowmen
Set Of 6 T-Lights Santa,2.95,38,0,Others,Set Of 6 T-Lights Santa
Set Of 9 Heart Shaped Balloons,1.25,29,0,Decoration,Set Of 9 Heart Shaped Balloons
Sandwich Bath Sponge,1.25,15,0,Others,Sandwich Bath Sponge
Apple Bath Sponge,1.25,35,0,Others,Apple Bath Sponge
Strawberry Bath Sponge,1.25,14,0,Others,Strawberry Bath Sponge
Black Pirate Treasure Chest,1.65,28,0,Others,Black Pirate Treasure Chest
Star Portable Table Light,2.95,15,0,Others,Star Portable Table Light
Snowflake Portable Table Light,2.95,22,0,Others,Snowflake Portable Table Light
Pink Oval Jewelled Mirror,5.95,37,0,Others,Pink Oval Jewelled Mirror
Retrospot Cigar Box Matches,1.25,5,0,Accessories,Retrospot Cigar Box Matches
Cosy Hour Giant Tube Matches,2.55,34,0,Others,Cosy Hour Giant Tube Matches
Jazz Hearts Purse Notebook,0.85,5,0,Decoration,Jazz Hearts Purse Notebook
Candleholder Pink Hanging Heart,2.95,38,0,Decoration,Candleholder Pink Hanging Heart
Assorted Colour Mini Cases,7.95,20,0,Others,Assorted Colour Mini Cases
Lunch Bag Spaceboy Design,1.65,9,0,Accessories,Lunch Bag Spaceboy Design
Lunch Bag Woodland,1.65,33,0,Accessories,Lunch Bag Woodland
Lunch Bag Pink Polkadot,1.65,33,0,Accessories,Lunch Bag Pink Polkadot
Gumball Coat Rack,2.55,38,0,Others,Gumball Coat Rack
Blue New Baroque Candlestick Candle,2.95,26,0,Decoration,Blue New Baroque Candlestick Candle
Pink New Baroquecandlestick Candle,2.95,38,0,Decoration,Pink New Baroquecandlestick Candle
Fairy Cake Flannel Assorted Colour,2.55,20,0,Others,Fairy Cake Flannel Assorted Colour
Bread Bin Diner Style Pink,16.95,26,0,Others,Bread Bin Diner Style Pink
Tea Time Table Cloth,10.65,37,0,Kitchen,Tea Time Table Cloth
Hot Water Bottle Babushka,4.25,26,0,Others,Hot Water Bottle Babushka
Heart Ivory Trellis Small,1.25,16,0,Decoration,Heart Ivory Trellis Small
Pink Drawer Knob Acrylic Edwardian,1.25,35,0,Others,Pink Drawer Knob Acrylic Edwardian
Green Drawer Knob Acrylic Edwardian,1.25,40,0,Others,Green Drawer Knob Acrylic Edwardian
Blue Drawer Knob Acrylic Edwardian,1.25,13,0,Others,Blue Drawer Knob Acrylic Edwardian
Set 6 Football Celebration Candles,1.25,26,0,Decoration,Set 6 Football Celebration Candles
Set Of 6 Girls Celebration Candles,1.25,5,0,Decoration,Set Of 6 Girls Celebration Candles
Romantic Pinks Ribbons,1.25,32,0,Others,Romantic Pinks Ribbons
Bright Blues Ribbons,1.25,7,0,Others,Bright Blues Ribbons
Chocolate Box Ribbons,1.25,19,0,Accessories,Chocolate Box Ribbons
Party Invites Football,0.85,6,0,Others,Party Invites Football
Party Invites Jazz Hearts,0.85,9,0,Decoration,Party Invites Jazz Hearts
Party Invites Spaceman,0.85,19,0,Others,Party Invites Spaceman
Set Of 3 Butterfly Cookie Cutters,1.25,10,0,Others,Set Of 3 Butterfly Cookie Cutters
Set Of 3 Heart Cookie Cutters,1.25,37,0,Decoration,Set Of 3 Heart Cookie Cutters
3 Piece Spaceboy Cookie Cutter Set,2.1,27,0,Others,3 Piece Spaceboy Cookie Cutter Set
Pack Of 72 Skull Cake Cases,0.55,26,0,Others,Pack Of 72 Skull Cake Cases
Pack Of 60 Spaceboy Cake Cases,0.55,12,0,Others,Pack Of 60 Spaceboy Cake Cases
72 Sweetheart Fairy Cake Cases,0.55,18,0,Decoration,72 Sweetheart Fairy Cake Cases
Lunch Bag Suki Design,1.65,10,0,Accessories,Lunch Bag Suki Design
Lunch Bag Cars Blue,1.65,17,0,Accessories,Lunch Bag Cars Blue
Lunch Bag Black Skull.,1.65,19,0,Accessories,Lunch Bag Black Skull.
Heart Ivory Trellis Large,1.65,40,0,Decoration,Heart Ivory Trellis Large
Set/5 Red Retrospot Lid Glass Bowls,2.55,14,0,Others,Set/5 Red Retrospot Lid Glass Bowls
Magic Drawing Slate Dinosaur,0.42,29,0,Others,Magic Drawing Slate Dinosaur
Magic Drawing Slate Bake A Cake,0.42,7,0,Others,Magic Drawing Slate Bake A Cake
12 Pencils Tall Tube Skulls,0.85,25,0,Others,12 Pencils Tall Tube Skulls
Red Harmonica In Box,1.25,24,0,Accessories,Red Harmonica In Box
Blue Harmonica In Box,1.25,6,0,Accessories,Blue Harmonica In Box
Skulls Water Transfer Tattoos,0.85,33,0,Others,Skulls Water Transfer Tattoos
Pack 3 Boxes Bird Pannetone,1.95,5,0,Accessories,Pack 3 Boxes Bird Pannetone
Set Of 20 Kids Cookie Cutters,2.1,16,0,Others,Set Of 20 Kids Cookie Cutters
10 Colour Spaceboy Pen,0.85,19,0,Others,10 Colour Spaceboy Pen
Victorian Glass Hanging T-Light,1.25,38,0,Others,Victorian Glass Hanging T-Light
Single Heart Zinc T-Light Holder,0.95,13,0,Decoration,Single Heart Zinc T-Light Holder
Hanging Metal Star Lantern,1.65,6,0,Decoration,Hanging Metal Star Lantern
Silver Hanging T-Light Holder,1.65,21,0,Others,Silver Hanging T-Light Holder
Doormat Red Retrospot,7.95,32,0,Others,Doormat Red Retrospot
Doormat Hearts,7.95,32,0,Decoration,Doormat Hearts
Natural Slate Rectangle Chalkboard,1.65,32,0,Others,Natural Slate Rectangle Chalkboard
Lovebird Hanging Decoration White,0.85,38,0,Others,Lovebird Hanging Decoration White
Pens Assorted Funny Face,0.85,16,0,Others,Pens Assorted Funny Face
Card Circus Parade,0.42,24,0,Others,Card Circus Parade
Wrap Cowboys,0.42,38,0,Others,Wrap Cowboys
Airline Bag Vintage Tokyo 78,4.25,18,0,Accessories,Airline Bag Vintage Tokyo 78
Set Of 72 Retrospot Paper Doilies,1.45,8,0,Others,Set Of 72 Retrospot Paper Doilies
Plasters In Tin Skulls,1.65,10,0,Others,Plasters In Tin Skulls
Sleeping Cat Erasers,0.21,20,0,Others,Sleeping Cat Erasers
Card Birthday Cowboy,0.42,11,0,Others,Card Birthday Cowboy
Pack 3 Boxes Christmas Pannetone,1.95,27,0,Accessories,Pack 3 Boxes Christmas Pannetone
Rotating Silver Angels T-Light Hldr,2.55,27,0,Others,Rotating Silver Angels T-Light Hldr
Ribbon Reel Making Snowmen,1.65,7,0,Others,Ribbon Reel Making Snowmen
4 Traditional Spinning Tops,1.25,34,0,Others,4 Traditional Spinning Tops
Bag 500G Swirly Marbles,1.65,36,0,Accessories,Bag 500G Swirly Marbles
5 Strand Glass Necklace Crystal,6.35,33,0,Others,5 Strand Glass Necklace Crystal
Squarecushion Cover Pink Union Flag,6.75,18,0,Others,Squarecushion Cover Pink Union Flag
Spaceboy Childrens Egg Cup,1.25,39,0,Kitchen,Spaceboy Childrens Egg Cup
Children'S Spaceboy Mug,1.65,31,0,Kitchen,Children'S Spaceboy Mug
Feltcraft Cushion Owl,3.75,21,0,Others,Feltcraft Cushion Owl
Black Candelabra T-Light Holder,2.1,12,0,Others,Black Candelabra T-Light Holder
Toy Tidy Dolly Girl Design,2.1,27,0,Toys,Toy Tidy Dolly Girl Design
Set 12 Lavender Botanical T-Lights,2.95,28,0,Others,Set 12 Lavender Botanical T-Lights
Union Jack Flag Luggage Tag,1.25,40,0,Others,Union Jack Flag Luggage Tag
Red Heart Luggage Tag,1.25,17,0,Decoration,Red Heart Luggage Tag
Red Glass Tassle Bag Charm,2.95,13,0,Accessories,Red Glass Tassle Bag Charm
Clear Acrylic Faceted Bangle,2.95,21,0,Others,Clear Acrylic Faceted Bangle
Doormat Union Jack Guns And Roses,7.95,26,0,Others,Doormat Union Jack Guns And Roses
Vanilla Scent Candle Jewelled Box,4.25,13,0,Decoration,Vanilla Scent Candle Jewelled Box
Full English Breakfast Plate,3.75,15,0,Others,Full English Breakfast Plate
Magic Drawing Slate Circus Parade,0.42,27,0,Others,Magic Drawing Slate Circus Parade
Christmas Hanging Heart With Bell,1.25,10,0,Decoration,Christmas Hanging Heart With Bell
Cake Stand Victorian Filigree Med,6.75,18,0,Others,Cake Stand Victorian Filigree Med
Paisley Pattern Stickers,0.85,16,0,Others,Paisley Pattern Stickers
Flowers Stickers,0.85,22,0,Others,Flowers Stickers
Black Love Bird Candle,1.25,25,0,Decoration,Black Love Bird Candle
Party Time Pencil Erasers,0.21,11,0,Others,Party Time Pencil Erasers
Pink B'Fly C/Cover W Bobbles,5.95,32,0,Others,Pink B'Fly C/Cover W Bobbles
Pink Union Jack Luggage Tag,1.25,26,0,Others,Pink Union Jack Luggage Tag
6 Ribbons Elegant Christmas,1.65,23,0,Others,6 Ribbons Elegant Christmas
Aged Glass Silver T-Light Holder,0.65,5,0,Others,Aged Glass Silver T-Light Holder
Boom Box Speaker Girls,5.95,16,0,Accessories,Boom Box Speaker Girls
6 Ribbons Shimmering Pinks,1.65,32,0,Others,6 Ribbons Shimmering Pinks
Jumbo Bag Owls,1.95,14,0,Accessories,Jumbo Bag Owls
Owl Doorstop,4.95,7,0,Others,Owl Doorstop
Painted Metal Star With Holly Bells,1.45,16,0,Others,Painted Metal Star With Holly Bells
Painted Metal Heart With Holly Bell,1.45,22,0,Decoration,Painted Metal Heart With Holly Bell
Angel Decoration Stars On Dress,0.42,8,0,Others,Angel Decoration Stars On Dress
Jumbo Bag Strawberry,1.95,38,0,Accessories,Jumbo Bag Strawberry
Strawberry Shopper Bag,1.25,15,0,Accessories,Strawberry Shopper Bag
Round Snack Boxes Set Of 4 Fruits,2.95,35,0,Accessories,Round Snack Boxes Set Of 4 Fruits
Round Snack Boxes Set Of 4 Skulls,2.95,15,0,Accessories,Round Snack Boxes Set Of 4 Skulls
Dolly Girl Lunch Box,1.95,7,0,Toys,Dolly Girl Lunch Box
Green Polkadot Plate,1.69,10,0,Others,Green Polkadot Plate
