Product Name,Price,Stock,Discount,Category,Description
Pink Pillar Candle Silver Flock,2.95,32,0,Decoration,Pink Pillar Candle Silver Flock
Standing Fairy Pole Support,0.85,13,0,Others,Standing Fairy Pole Support
2 Picture Book Eggs Easter Ducks,1.25,37,0,Others,2 Picture Book Eggs Easter Ducks
2 Picture Book Eggs Easter Chicks,1.25,26,0,Others,2 Picture Book Eggs Easter Chicks
Vintage Bead Pink Shade,1.25,35,0,Others,Vintage Bead Pink Shade
Decorative Hanging Shelving Unit,59.95,40,0,Others,Decorative Hanging Shelving Unit
Musical Zinc Heart Decoration,1.63,8,0,Decoration,Musical Zinc Heart Decoration
"Rustic Wooden Cabinet, Glass Doors",49.96,22,0,Others,"Rustic Wooden Cabinet, Glass Doors"
Tiny Crystal Bracelet Red,2.48,7,0,Others,Tiny Crystal Bracelet Red
White/Pink Chick Easter Decoration,0.85,31,0,Others,White/Pink Chick Easter Decoration
Easter Craft Ivy Wreath With Chick,1.95,11,0,Others,Easter Craft Ivy Wreath With Chick
White Beaded Garland String 20Light,6.35,37,0,Others,White Beaded Garland String 20Light
Steel Sweetheart Round Table Cream,14.95,23,0,Decoration,Steel Sweetheart Round Table Cream
Orange Flower Mug,1.25,23,0,Kitchen,Orange Flower Mug
Gingham Heart Decoration,1.63,20,0,Decoration,Gingham Heart Decoration
Moroccan Beaten Metal Dish,20.79,8,0,Others,Moroccan Beaten Metal Dish
S/2 Zinc Heart Design Planters,9.95,10,0,Decoration,S/2 Zinc Heart Design Planters
Retrospot Wooden Heart Decoration,1.63,22,0,Decoration,Retrospot Wooden Heart Decoration
Cupid Scented Candle In Glass,1.65,20,0,Kitchen,Cupid Scented Candle In Glass
White Heart Of Glass Bracelet,5.95,8,0,Decoration,White Heart Of Glass Bracelet
Pink Heart Of Glass Bracelet,5.95,10,0,Decoration,Pink Heart Of Glass Bracelet
Long Silver Necklace Pastel Flower,12.75,23,0,Others,Long Silver Necklace Pastel Flower
Gold/M.O.P Pendant Orbit Necklace,8.5,21,0,Others,Gold/M.O.P Pendant Orbit Necklace
Silver/M.O.P Pendant Orbit Necklace,8.5,22,0,Others,Silver/M.O.P Pendant Orbit Necklace
Floral Bathroom Set,3.75,37,0,Others,Floral Bathroom Set
Vintage Notebook Travelogue,2.95,8,0,Others,Vintage Notebook Travelogue
Black Drop Earrings W Long Beads,2.9,7,0,Others,Black Drop Earrings W Long Beads
Ooh La La Dogs Collar,15.79,32,0,Others,Ooh La La Dogs Collar
15 Pink Fluffy Chicks In Box,2.95,34,0,Accessories,15 Pink Fluffy Chicks In Box
Zinc Heart Lattice Tray Oval,5.95,19,0,Decoration,Zinc Heart Lattice Tray Oval
Set Of 6 Ice Cream Skittles,2.95,7,0,Others,Set Of 6 Ice Cream Skittles
Blue Cushion Cover With Flower,6.95,25,0,Others,Blue Cushion Cover With Flower
Pink Yellow Patch Cushion Cover,7.65,16,0,Others,Pink Yellow Patch Cushion Cover
Pink String Curtain With Pole,19.13,25,0,Others,Pink String Curtain With Pole
Hanging Heart With Bell,2.46,36,0,Decoration,Hanging Heart With Bell
A4 Wall Tidy Red Flowers,0.65,9,0,Others,A4 Wall Tidy Red Flowers
Incense Bazaar Peach,0.42,7,0,Others,Incense Bazaar Peach
Tranquility Masala Incense,0.21,26,0,Others,Tranquility Masala Incense
Ocean Stripe Hammock,7.95,10,0,Others,Ocean Stripe Hammock
Elephant Clip W Suction Cup,0.42,33,0,Kitchen,Elephant Clip W Suction Cup
White Hydrangea Art Flower,2.1,35,0,Others,White Hydrangea Art Flower
Cream Climbing Hydranga Art Flower,3.75,17,0,Others,Cream Climbing Hydranga Art Flower
Blue Stones On Wire For Candle,0.21,17,0,Decoration,Blue Stones On Wire For Candle
Glitter Heart Decoration,0.85,8,0,Decoration,Glitter Heart Decoration
Pink Gauze Butterfly Lampshade,0.42,10,0,Others,Pink Gauze Butterfly Lampshade
Cherry Blossom Canvas Art Picture,7.95,29,0,Others,Cherry Blossom Canvas Art Picture
Botanical Lavender Gift Wrap,0.42,38,0,Others,Botanical Lavender Gift Wrap
Necklace+Bracelet Pink Butterfly,2.55,28,0,Others,Necklace+Bracelet Pink Butterfly
Ice Cream Design Garden Parasol,7.95,33,0,Others,Ice Cream Design Garden Parasol
Set 2 Pantry Design Tea Towels,2.95,29,0,Kitchen,Set 2 Pantry Design Tea Towels
Metal Rabbit Ladder Easter,0.85,32,0,Others,Metal Rabbit Ladder Easter
Lunch Box With Cutlery Fairy Cakes,2.55,35,0,Accessories,Lunch Box With Cutlery Fairy Cakes
Cotton Apron Pantry Design,4.95,15,0,Others,Cotton Apron Pantry Design
Candy Spot Tea Cosy,3.35,26,0,Kitchen,Candy Spot Tea Cosy
Icon Mug Revolutionary,1.25,6,0,Kitchen,Icon Mug Revolutionary
Boys Party Bag,3.29,22,0,Accessories,Boys Party Bag
Girls Party Bag,3.29,31,0,Accessories,Girls Party Bag
"Acrylic Jewel Snowflake, Pink",2.1,23,0,Others,"Acrylic Jewel Snowflake, Pink"
"Pocket Mirror ""Glamorous""",1.25,12,0,Others,"Pocket Mirror ""Glamorous"""
Large Zinc Glass Candleholder,4.13,40,0,Decoration,Large Zinc Glass Candleholder
"Retro Pill Box , Revolutionary",0.42,35,0,Accessories,"Retro Pill Box , Revolutionary"
Painted Sea Shell Metal Windchime,3.75,37,0,Others,Painted Sea Shell Metal Windchime
Folding Shoe Tidy,2.95,33,0,Others,Folding Shoe Tidy
Madras Notebook Medium,2.55,24,0,Others,Madras Notebook Medium
Square Metal Candleholder Base,0.85,19,0,Decoration,Square Metal Candleholder Base
M/Colour Pom-Pom Curtain,4.25,23,0,Others,M/Colour Pom-Pom Curtain
Black Cherry Lights,6.75,30,0,Others,Black Cherry Lights
Black Vintage Crystal Earrings,3.75,20,0,Others,Black Vintage Crystal Earrings
White Vintage Crystal Earrings,3.75,25,0,Others,White Vintage Crystal Earrings
White Vint Art Deco Crystal Necklac,8.5,20,0,Others,White Vint Art Deco Crystal Necklac
Black Vint Art Dec Crystal Necklace,8.5,10,0,Others,Black Vint Art Dec Crystal Necklace
New Baroque Small Necklace Black,8.5,17,0,Others,New Baroque Small Necklace Black
Lilac Gauze Butterfly Lampshade,0.42,14,0,Others,Lilac Gauze Butterfly Lampshade
Pink/Purple Circle Curtain,4.65,24,0,Others,Pink/Purple Circle Curtain
Potting Shed Rose Candle,2.46,15,0,Decoration,Potting Shed Rose Candle
Heart Buttons Jewellery Box,4.96,23,0,Decoration,Heart Buttons Jewellery Box
New Baroque B'Fly Necklace Red,8.32,8,0,Others,New Baroque B'Fly Necklace Red
Purple Foxglove Artiifcial Flower,2.55,19,0,Others,Purple Foxglove Artiifcial Flower
Pink Allium Artificial Flower,1.69,20,0,Others,Pink Allium Artificial Flower
Giant Medina Stamped Metal Bowl,9.95,7,0,Others,Giant Medina Stamped Metal Bowl
Pink Flowers Rabbit Easter,2.95,29,0,Others,Pink Flowers Rabbit Easter
Purple Amethyst Necklace W Tassel,9.95,15,0,Others,Purple Amethyst Necklace W Tassel
Blue/Nat Shell Necklace W Pendant,5.95,19,0,Others,Blue/Nat Shell Necklace W Pendant
Pink Disco Handbag,5.95,18,0,Accessories,Pink Disco Handbag
Pantry Scrubbing Brush,1.65,31,0,Others,Pantry Scrubbing Brush
Set Of 4 Pantry Jelly Moulds,1.25,32,0,Others,Set Of 4 Pantry Jelly Moulds
Travel Card Wallet Flower Meadow,0.42,19,0,Others,Travel Card Wallet Flower Meadow
Travel Card Wallet Pantry,0.42,11,0,Others,Travel Card Wallet Pantry
Travel Card Wallet Skulls,0.42,22,0,Others,Travel Card Wallet Skulls
Travel Card Wallet Vintage Rose,0.42,31,0,Others,Travel Card Wallet Vintage Rose
Travel Card Wallet Transport,0.42,29,0,Others,Travel Card Wallet Transport
Travel Card Wallet Retrospot,0.42,35,0,Others,Travel Card Wallet Retrospot
Travel Card Wallet Keep Calm,0.42,29,0,Others,Travel Card Wallet Keep Calm
Giraffe Wooden Ruler,1.95,35,0,Others,Giraffe Wooden Ruler
Revolver Wooden Ruler,1.95,19,0,Others,Revolver Wooden Ruler
Travel Card Wallet Retro Petals,0.36,11,0,Others,Travel Card Wallet Retro Petals
Travel Card Wallet Suki,0.36,18,0,Others,Travel Card Wallet Suki
Travel Card Wallet Vintage Ticket,0.36,8,0,Others,Travel Card Wallet Vintage Ticket
Pantry Rolling Pin,3.75,12,0,Others,Pantry Rolling Pin
Travel Card Wallet Union Jack,0.42,38,0,Others,Travel Card Wallet Union Jack
Travel Card Wallet I Love London,0.42,11,0,Others,Travel Card Wallet I Love London
"Retro Tin Ashtray,Revolutionary",0.65,40,0,Others,"Retro Tin Ashtray,Revolutionary"
Fuschia Table Run Flower,3.75,25,0,Others,Fuschia Table Run Flower
Set/6 Posies Paper Cups,0.83,12,0,Kitchen,Set/6 Posies Paper Cups
Purple/Blue Ceramic Candle Holder,3.29,26,0,Decoration,Purple/Blue Ceramic Candle Holder
Purple/Copper Hanging Lampshade,0.85,21,0,Others,Purple/Copper Hanging Lampshade
Childrens Cutlery Polkadot Blue,4.15,22,0,Others,Childrens Cutlery Polkadot Blue
Childrens Cutlery Polkadot Pink,4.15,33,0,Others,Childrens Cutlery Polkadot Pink
S/3 Pink Square Planters Roses,10.95,34,0,Others,S/3 Pink Square Planters Roses
Blue White Plastic Rings Lampshade,0.85,37,0,Others,Blue White Plastic Rings Lampshade
White Vintage Crystal Bracelet,6.75,24,0,Others,White Vintage Crystal Bracelet
Glass Bead Hoop Necklace Amethyst,8.5,9,0,Others,Glass Bead Hoop Necklace Amethyst
Raspberry Ant Copper Flower Necklac,5.95,10,0,Others,Raspberry Ant Copper Flower Necklac
Glass Bead Hoop Necklace Green,8.5,15,0,Others,Glass Bead Hoop Necklace Green
Glass Bead Hoop Necklace Montana,8.5,17,0,Others,Glass Bead Hoop Necklace Montana
Pink And Black String Curtain,5.95,14,0,Others,Pink And Black String Curtain
Pack 20 Dolly Pegs,0.72,36,0,Toys,Pack 20 Dolly Pegs
Jumbo Bag Scandinavian Blue Paisley,4.13,34,0,Accessories,Jumbo Bag Scandinavian Blue Paisley
Childrens Cutlery Retrospot Red,4.15,37,0,Others,Childrens Cutlery Retrospot Red
Childrens Cutlery Polkadot Green,4.15,18,0,Others,Childrens Cutlery Polkadot Green
Scallop Shell Soap Dish,2.1,38,0,Others,Scallop Shell Soap Dish
Pink Riviera Handbag,11.63,29,0,Accessories,Pink Riviera Handbag
Top Secret Pen Set,1.25,37,0,Others,Top Secret Pen Set
Beach Hut Shelf W 3 Drawers,11.63,13,0,Others,Beach Hut Shelf W 3 Drawers
Necklace+Bracelet Set Pink Daisy,2.55,27,0,Others,Necklace+Bracelet Set Pink Daisy
Pink Chrysanthemums Art Flower,2.1,39,0,Others,Pink Chrysanthemums Art Flower
Best Dad Candle Letters,0.85,24,0,Decoration,Best Dad Candle Letters
Groovy Cactus Inflatable,0.85,12,0,Others,Groovy Cactus Inflatable
Heavens Scent Fragrance Oils Asstd,0.29,28,0,Others,Heavens Scent Fragrance Oils Asstd
Small Single Flame Candle Holder,0.35,11,0,Decoration,Small Single Flame Candle Holder
Pink Murano Twist Necklace,9.98,9,0,Others,Pink Murano Twist Necklace
Orange/Wht/Fuschia Stones Necklace,4.98,20,0,Others,Orange/Wht/Fuschia Stones Necklace
Riviera Necklace,4.98,7,0,Others,Riviera Necklace
Classic Diamante Necklace Jet,7.48,11,0,Others,Classic Diamante Necklace Jet
Diamante Necklace,8.32,28,0,Others,Diamante Necklace
Classic Diamante Earrings Jet,2.9,6,0,Others,Classic Diamante Earrings Jet
Blue Drop Earrings W Bead Cluster,3.32,31,0,Others,Blue Drop Earrings W Bead Cluster
Antique Raspberry Flower Earrings,4.15,32,0,Others,Antique Raspberry Flower Earrings
Purple Anemone Artificial Flower,1.69,22,0,Others,Purple Anemone Artificial Flower
White Allium Artificial Flower,1.69,31,0,Others,White Allium Artificial Flower
Pink Foxglove Artiifcial Flower,2.55,28,0,Others,Pink Foxglove Artiifcial Flower
Toilet Sign Occupied Or Vacant,0.83,18,0,Kitchen,Toilet Sign Occupied Or Vacant
Small Blue Provencal Ceramic Ball,1.65,17,0,Others,Small Blue Provencal Ceramic Ball
Pantry Washing Up Brush,1.45,26,0,Others,Pantry Washing Up Brush
Treasure Island Book Box,2.25,6,0,Accessories,Treasure Island Book Box
Buffalo Bill Treasure Book Box,2.25,25,0,Accessories,Buffalo Bill Treasure Book Box
Gymkhanna Treasure Book Box,2.25,13,0,Accessories,Gymkhanna Treasure Book Box
Abc Treasure Book Box,2.25,33,0,Accessories,Abc Treasure Book Box
Pantry Pastry Brush,1.25,35,0,Others,Pantry Pastry Brush
Dollcraft Girl Amelie Kit,4.95,30,0,Toys,Dollcraft Girl Amelie Kit
Dollcraft Girl Nicole,4.95,38,0,Toys,Dollcraft Girl Nicole
Clear Stationery Box Set,0.85,14,0,Accessories,Clear Stationery Box Set
Silver/Black Pendant Orbit Necklace,8.32,36,0,Others,Silver/Black Pendant Orbit Necklace
Baroque Butterfly Earrings Pink,3.73,40,0,Others,Baroque Butterfly Earrings Pink
Feltcraft Girl Nicole Kit,4.95,38,0,Others,Feltcraft Girl Nicole Kit
Feltcraft Boy Jean-Paul Kit,4.95,35,0,Others,Feltcraft Boy Jean-Paul Kit
Feltcraft Girl Amelie Kit,4.95,23,0,Others,Feltcraft Girl Amelie Kit
Gymkhana Treasure Book Box,2.25,39,0,Accessories,Gymkhana Treasure Book Box
Mother'S Kitchen Spoon Rest,3.75,6,0,Others,Mother'S Kitchen Spoon Rest
Clock Magnet Mum'S Kitchen,2.89,13,0,Others,Clock Magnet Mum'S Kitchen
Jam Clock Magnet,2.89,35,0,Others,Jam Clock Magnet
Pantry Apple Corer,1.45,35,0,Others,Pantry Apple Corer
White With Black Cats Plate,0.85,7,0,Others,White With Black Cats Plate
Mum'S Kitchen Clock,4.95,39,0,Others,Mum'S Kitchen Clock
Recycled Acapulco Mat Red,8.25,21,0,Others,Recycled Acapulco Mat Red
Recycled Acapulco Mat Pink,8.25,39,0,Others,Recycled Acapulco Mat Pink
Recycled Acapulco Mat Lavender,8.25,20,0,Others,Recycled Acapulco Mat Lavender
Recycled Acapulco Mat Green,8.25,29,0,Others,Recycled Acapulco Mat Green
Recycled Acapulco Mat Turquoise,8.25,24,0,Others,Recycled Acapulco Mat Turquoise
Recycled Acapulco Mat Blue,8.25,35,0,Others,Recycled Acapulco Mat Blue
"S/4 Icon Coaster,Elvis Lives",1.25,15,0,Others,"S/4 Icon Coaster,Elvis Lives"
Dollcraft Boy Jean-Paul,4.95,33,0,Toys,Dollcraft Boy Jean-Paul
French Style Storage Jar Jam,1.25,5,0,Others,French Style Storage Jar Jam
Bull Dog Bottle Opener,4.95,19,0,Others,Bull Dog Bottle Opener
Pink Crystal Guitar Phone Charm,0.85,14,0,Others,Pink Crystal Guitar Phone Charm
Black Feather Christmas Decoration,0.19,14,0,Others,Black Feather Christmas Decoration
Glass And Beads Bracelet Ivory,3.75,8,0,Others,Glass And Beads Bracelet Ivory
Purple/Turq Flowers Handbag,1.25,6,0,Accessories,Purple/Turq Flowers Handbag
Crochet Rose Des Clothes Hanger,2.95,11,0,Others,Crochet Rose Des Clothes Hanger
Blue Hole Punch,1.25,5,0,Others,Blue Hole Punch
Baby Mouse Red Gingham Dress,4.25,26,0,Others,Baby Mouse Red Gingham Dress
Bull Dog Bottle Top Wall Clock,8.25,12,0,Others,Bull Dog Bottle Top Wall Clock
French Style Storage Jar Bonbons,1.25,31,0,Others,French Style Storage Jar Bonbons
Dollcraft Girl Amelie,4.95,8,0,Toys,Dollcraft Girl Amelie
French Style Storage Jar Cafe,1.25,18,0,Others,French Style Storage Jar Cafe
Yellow/Blue Retro Radio,2.95,21,0,Others,Yellow/Blue Retro Radio
"Retro Pill Box Key Chain,The King",0.19,19,0,Accessories,"Retro Pill Box Key Chain,The King"
Circus Parade Baby Gift Set,16.95,9,0,Others,Circus Parade Baby Gift Set
Spaceboy Baby Gift Set,16.95,26,0,Others,Spaceboy Baby Gift Set
I Love London Baby Gift Set,14.95,8,0,Others,I Love London Baby Gift Set
Dolly Girl Baby Gift Set,14.95,28,0,Toys,Dolly Girl Baby Gift Set
English Rose Notebook A6 Size,0.65,6,0,Others,English Rose Notebook A6 Size
Pastel Pink Photo Album,0.5,35,0,Others,Pastel Pink Photo Album
Blue Polkadot Beaker,1.63,20,0,Others,Blue Polkadot Beaker
Hello Sailor Bathroom Set,3.75,30,0,Others,Hello Sailor Bathroom Set
Hen House W Chick In Nest,0.42,9,0,Others,Hen House W Chick In Nest
Wrap Bad Hair Day,0.1,18,0,Others,Wrap Bad Hair Day
Piece Of Camo Stationery Set,0.21,5,0,Others,Piece Of Camo Stationery Set
Wine Bottle Dressing Lt.Blue,0.29,23,0,Others,Wine Bottle Dressing Lt.Blue
Doormat Christmas Village,15.79,38,0,Others,Doormat Christmas Village
Wire Flower T-Light Holder,1.25,21,0,Others,Wire Flower T-Light Holder
Antique Silver T-Light Glass,1.25,20,0,Others,Antique Silver T-Light Glass
Set Of 16 Vintage Ivory Cutlery,12.75,9,0,Others,Set Of 16 Vintage Ivory Cutlery
Montana Diamond Cluster Necklace,8.95,12,0,Others,Montana Diamond Cluster Necklace
"Ruby Glass Necklace 42""",7.5,38,0,Others,"Ruby Glass Necklace 42"""
Jungle Popsicles Ice Lolly Moulds,1.25,19,0,Others,Jungle Popsicles Ice Lolly Moulds
Pink Small Glass Cake Stand,1.95,31,0,Others,Pink Small Glass Cake Stand
Flag Of St George Chair,5.95,7,0,Others,Flag Of St George Chair
Yellow Pink Flower Design Big Bowl,0.39,32,0,Others,Yellow Pink Flower Design Big Bowl
French Chateau Oval Platter,1.95,23,0,Kitchen,French Chateau Oval Platter
Assorted Sanskrit Mini Notebook,1.25,18,0,Others,Assorted Sanskrit Mini Notebook
Blue Flower Des Purse,1.25,37,0,Others,Blue Flower Des Purse
Elvis Wallhanging / Curtain,1.25,27,0,Others,Elvis Wallhanging / Curtain
Amethyst 3 Bead Drop Earrings,2.9,6,0,Others,Amethyst 3 Bead Drop Earrings
Big Polkadot Mug,0.39,18,0,Kitchen,Big Polkadot Mug
Green Murano Twist Necklace,9.98,25,0,Others,Green Murano Twist Necklace
Pink/Amethyst/Gold Necklace,6.95,23,0,Others,Pink/Amethyst/Gold Necklace
Assorted Colour Silk Glasses Case,2.1,28,0,Others,Assorted Colour Silk Glasses Case
Doughnut Lip Gloss,1.25,11,0,Others,Doughnut Lip Gloss
Ice Cream Sundae Lip Gloss,1.25,22,0,Others,Ice Cream Sundae Lip Gloss
Ice Cream Pen Lip Gloss,1.25,20,0,Others,Ice Cream Pen Lip Gloss
Open Closed Metal Sign,4.95,40,0,Others,Open Closed Metal Sign
Wine Bottle Dressing Dark Blue,0.29,12,0,Others,Wine Bottle Dressing Dark Blue
Crochet Bear Red/Blue Keyring,1.65,17,0,Others,Crochet Bear Red/Blue Keyring
Fan Black Frame,0.29,15,0,Others,Fan Black Frame
Wrap Billboard Fonts Design,0.42,34,0,Others,Wrap Billboard Fonts Design
Set Of 5 Pancake Day Magnets,2.08,25,0,Others,Set Of 5 Pancake Day Magnets
Set Of 4 Jam Jar Magnets,2.08,15,0,Others,Set Of 4 Jam Jar Magnets
Set Of 5 Mini Grocery Magnets,2.08,34,0,Others,Set Of 5 Mini Grocery Magnets
Knickerbockerglory Magnet Assorted,0.83,12,0,Others,Knickerbockerglory Magnet Assorted
Pack 4 Flower/Butterfly Patches,1.25,36,0,Others,Pack 4 Flower/Butterfly Patches
Set Of 5 Lucky Cat Magnets,1.85,30,0,Others,Set Of 5 Lucky Cat Magnets
Jardin Etched Glass Large Bell Jar,12.75,17,0,Others,Jardin Etched Glass Large Bell Jar
Mummy Mouse Red Gingham Ribbon,5.45,34,0,Others,Mummy Mouse Red Gingham Ribbon
French Chateau Small Fruitbowl,1.95,18,0,Kitchen,French Chateau Small Fruitbowl
French Chateau Large Fruit Bowl,1.95,9,0,Kitchen,French Chateau Large Fruit Bowl
Wrap Carousel,0.42,20,0,Others,Wrap Carousel
Small Tahiti Beach Bag,4.65,8,0,Accessories,Small Tahiti Beach Bag
Goldie Looking Mirror,4.95,38,0,Others,Goldie Looking Mirror
Orange Felt Vase + Flowers,1.25,35,0,Others,Orange Felt Vase + Flowers
Set Of 6 Nativity Magnets,2.08,38,0,Others,Set Of 6 Nativity Magnets
Set Of 12 Rose Botanical T-Lights,5.79,32,0,Others,Set Of 12 Rose Botanical T-Lights
Crochet White Rabbit Keyring,3.29,8,0,Others,Crochet White Rabbit Keyring
Silver/Black Orbit Necklace,9.95,40,0,Others,Silver/Black Orbit Necklace
Vintage Bead Cosmetic Bag,3.35,30,0,Accessories,Vintage Bead Cosmetic Bag
Enamel Blue Rim Tea Container,0.83,15,0,Kitchen,Enamel Blue Rim Tea Container
Beach Hut Mirror,4.25,15,0,Others,Beach Hut Mirror
Decoration Wobbly Rabbit Metal,3.29,37,0,Others,Decoration Wobbly Rabbit Metal
Blue Cat Biscuit Barrel Pink Heart,4.13,27,0,Decoration,Blue Cat Biscuit Barrel Pink Heart
Hen House With Chick Standing,0.42,34,0,Others,Hen House With Chick Standing
Black Photo Album,0.5,39,0,Others,Black Photo Album
Tumbler Baroque,0.39,19,0,Others,Tumbler Baroque
Decoration Wobbly Chicken,3.29,19,0,Others,Decoration Wobbly Chicken
Pink Round Compact Mirror,1.25,34,0,Others,Pink Round Compact Mirror
Blue Square Compact Mirror,1.25,39,0,Others,Blue Square Compact Mirror
Childrens Cutlery Dolly Girl,4.15,32,0,Toys,Childrens Cutlery Dolly Girl
Childrens Cutlery Spaceboy,4.15,22,0,Others,Childrens Cutlery Spaceboy
New Baroque B'Fly Necklace Pink,8.5,22,0,Others,New Baroque B'Fly Necklace Pink
Childrens Cutlery Circus Parade,4.15,15,0,Others,Childrens Cutlery Circus Parade
Tumbler New England,0.39,5,0,Others,Tumbler New England
Botanical Lily Gift Wrap,0.42,7,0,Others,Botanical Lily Gift Wrap
Baroque Butterfly Earrings Black,3.75,40,0,Others,Baroque Butterfly Earrings Black
Yellow/Orange Flower Design Plate,0.29,13,0,Others,Yellow/Orange Flower Design Plate
Charlotte Bag Vintage Alphabet,0.85,22,0,Accessories,Charlotte Bag Vintage Alphabet
Jumbo Bag Alphabet,2.08,29,0,Accessories,Jumbo Bag Alphabet
Lunch Bag Alphabet Design,1.65,32,0,Accessories,Lunch Bag Alphabet Design
Jumbo Bag Apples,2.08,28,0,Accessories,Jumbo Bag Apples
Lunch Bag Apple Design,1.65,36,0,Accessories,Lunch Bag Apple Design
Charlotte Bag Apples Design,0.85,39,0,Accessories,Charlotte Bag Apples Design
Charlotte Bag Alphabet Design,0.85,26,0,Accessories,Charlotte Bag Alphabet Design
Kids Cutlery Spaceboy,4.15,12,0,Others,Kids Cutlery Spaceboy
Kids Cutlery Dolly Girl,4.15,39,0,Toys,Kids Cutlery Dolly Girl
Lunch Bag Vintage Leaf Design,1.65,5,0,Accessories,Lunch Bag Vintage Leaf Design
S/2 Beach Hut Treasure Chests,5.95,21,0,Others,S/2 Beach Hut Treasure Chests
Blue Padded Soft Mobile,4.25,34,0,Others,Blue Padded Soft Mobile
Pink Feathers Curtain,1.25,15,0,Others,Pink Feathers Curtain
Pads To Match All Cushions,0.001,39,0,Others,Pads To Match All Cushions
Squarecushion Cover Pink Union Jack,6.75,28,0,Others,Squarecushion Cover Pink Union Jack
3 Birds Canvas Screen,1.65,23,0,Others,3 Birds Canvas Screen
Large Deco Jewellery Stand,12.5,26,0,Others,Large Deco Jewellery Stand
Pastel Blue Photo Album,0.5,33,0,Others,Pastel Blue Photo Album
Heart Beaded Trellis Decoration,2.08,24,0,Decoration,Heart Beaded Trellis Decoration
Gemstone Chandelier T-Light Holder,4.15,23,0,Others,Gemstone Chandelier T-Light Holder
16 Piece Cutlery Set Pantry Design,33.29,26,0,Others,16 Piece Cutlery Set Pantry Design
Beaded Chandelier T-Light Holder,4.95,36,0,Others,Beaded Chandelier T-Light Holder
Childrens Toy Cooking Utensil Set,4.13,22,0,Toys,Childrens Toy Cooking Utensil Set
Black Glass/Shell/Pearl Necklace,9.15,31,0,Others,Black Glass/Shell/Pearl Necklace
Small Deco Jewellery Stand,8.25,13,0,Others,Small Deco Jewellery Stand
Aluminium Stamped Heart,2.49,35,0,Decoration,Aluminium Stamped Heart
Double Ceramic Parlour Hook,4.15,39,0,Others,Double Ceramic Parlour Hook
Zinc Sweetheart Wire Letter Rack,3.75,21,0,Decoration,Zinc Sweetheart Wire Letter Rack
"Flower Glass Garland Neckl.36""Blue",7.9,26,0,Others,"Flower Glass Garland Neckl.36""Blue"
Parlour Ceramic Wall Hook,4.15,35,0,Others,Parlour Ceramic Wall Hook
Georgian Trinket Box,12.5,26,0,Accessories,Georgian Trinket Box
Orange/Fuschia Stones Necklace,4.98,14,0,Others,Orange/Fuschia Stones Necklace
Cote D'Azure Necklace,4.98,6,0,Others,Cote D'Azure Necklace
Triple Hook Antique Ivory Rose,3.29,28,0,Others,Triple Hook Antique Ivory Rose
Vintage Embossed Heart,1.25,7,0,Decoration,Vintage Embossed Heart
Gold Wine Goblet,0.79,32,0,Others,Gold Wine Goblet
Gold Aperitif Glass,0.39,27,0,Others,Gold Aperitif Glass
Ivory Chandelier T-Light Holder,6.25,31,0,Others,Ivory Chandelier T-Light Holder
Flowers Chandelier T-Light Holder,6.25,32,0,Others,Flowers Chandelier T-Light Holder
Triple Wire Hook Ivory Heart,4.15,24,0,Decoration,Triple Wire Hook Ivory Heart
Triple Wire Hook Pink Heart,4.15,24,0,Decoration,Triple Wire Hook Pink Heart
Small Zinc Heart Wall Organiser,5.75,40,0,Decoration,Small Zinc Heart Wall Organiser
Small Ivory Heart Wall Organiser,5.75,39,0,Decoration,Small Ivory Heart Wall Organiser
Marie Antoienett Trinket Box Gold,12.5,17,0,Accessories,Marie Antoienett Trinket Box Gold
Ivory Sweetheart Wire Letter Rack,3.75,12,0,Decoration,Ivory Sweetheart Wire Letter Rack
Large Zinc Heart Wall Organiser,7.05,39,0,Decoration,Large Zinc Heart Wall Organiser
Large Ivory Heart Wall Organiser,7.05,40,0,Decoration,Large Ivory Heart Wall Organiser
60 Gold And Silver Fairy Cake Cases,0.55,8,0,Others,60 Gold And Silver Fairy Cake Cases
Single Antique Rose Hook Ivory,1.45,10,0,Others,Single Antique Rose Hook Ivory
Miniature Antique Rose Hook Ivory,0.83,11,0,Others,Miniature Antique Rose Hook Ivory
Zinc T-Light Holder Stars Small,0.72,30,0,Others,Zinc T-Light Holder Stars Small
Ivory Wire Kitchen Organiser,10.4,19,0,Others,Ivory Wire Kitchen Organiser
Ivory Wire Sweetheart Letter Tray,3.75,12,0,Decoration,Ivory Wire Sweetheart Letter Tray
Single Wire Hook Pink Heart,1.45,22,0,Decoration,Single Wire Hook Pink Heart
Single Wire Hook Ivory Heart,1.45,17,0,Decoration,Single Wire Hook Ivory Heart
Ivory Sweetheart Soap Dish,2.49,35,0,Decoration,Ivory Sweetheart Soap Dish
Zinc T-Light Holder Star Large,0.95,17,0,Others,Zinc T-Light Holder Star Large
Baroque Butterfly Earrings Red,3.73,21,0,Others,Baroque Butterfly Earrings Red
Zinc Wire Sweetheart Letter Tray,3.75,7,0,Decoration,Zinc Wire Sweetheart Letter Tray
Lilac Votive Candle,0.21,34,0,Decoration,Lilac Votive Candle
Teatime Gel Pens Asst,0.42,15,0,Kitchen,Teatime Gel Pens Asst
Edwardian Photo Frame,6.25,12,0,Others,Edwardian Photo Frame
Maxwell 2 Tone Blue 60 Page Photo A,0.5,21,0,Others,Maxwell 2 Tone Blue 60 Page Photo A
Mistletoe Heart Wreath Cream,4.15,13,0,Decoration,Mistletoe Heart Wreath Cream
Hanging Engraved Metal Heart,4.15,16,0,Decoration,Hanging Engraved Metal Heart
Blue Table Run Flower,1.25,21,0,Others,Blue Table Run Flower
Blue Stripes Shoulder Bag,0.83,8,0,Accessories,Blue Stripes Shoulder Bag
Laser Cut Multi Strand Necklace,11.95,26,0,Others,Laser Cut Multi Strand Necklace
Regency Sugar Tongs,2.49,5,0,Others,Regency Sugar Tongs
Doormat Keep Calm And Come In,6.75,24,0,Others,Doormat Keep Calm And Come In
Doormat Vintage Leaves Design,7.95,15,0,Others,Doormat Vintage Leaves Design
Regency Tea Strainer,3.75,17,0,Kitchen,Regency Tea Strainer
Flag Of St George Car Flag,0.83,28,0,Others,Flag Of St George Car Flag
Haynes Camper Shoulder Bag,16.63,33,0,Accessories,Haynes Camper Shoulder Bag
Small Zinc/Glass Candleholder,1.25,37,0,Decoration,Small Zinc/Glass Candleholder
Gold Flower Cushion Cover,1.95,9,0,Others,Gold Flower Cushion Cover
Set Of 10 Lanterns Fairy Light Star,4.15,39,0,Decoration,Set Of 10 Lanterns Fairy Light Star
Paper Lantern 7 Point Snow Star,6.65,34,0,Decoration,Paper Lantern 7 Point Snow Star
Paper Lantern 9 Point Snow Star,4.15,21,0,Decoration,Paper Lantern 9 Point Snow Star
Cinderella Chandelier,49.95,24,0,Others,Cinderella Chandelier
Bling Key Ring Stand,1.25,13,0,Others,Bling Key Ring Stand
Multicolour Polkadot Plate,6.63,12,0,Others,Multicolour Polkadot Plate
Mistletoe Heart Wreath Green,4.15,35,0,Decoration,Mistletoe Heart Wreath Green
White 3 Frame Birds And Tree,21.95,13,0,Others,White 3 Frame Birds And Tree
Wrap Summer Rose Design,0.42,23,0,Others,Wrap Summer Rose Design
Regency Tea Spoon,1.04,10,0,Kitchen,Regency Tea Spoon
