Product Name,Price,Stock,Discount,Category,Description
Set Of 4 Fairy Cake Placemats,3.75,30,0,Others,Set Of 4 Fairy Cake Placemats
Office Mug Warmer Pink,2.95,7,0,Kitchen,Office Mug Warmer Pink
Please One Person Metal Sign,2.1,35,0,Others,Please One Person Metal Sign
Glitter Christmas Heart,0.85,22,0,Decoration,Glitter Christmas Heart
Red Stripe Ceramic Drawer Knob,1.25,16,0,Others,Red Stripe Ceramic Drawer Knob
"Nursery A,B,C Painted Letters",6.75,15,0,Others,"Nursery A,B,C Painted Letters"
Set Of 2 Round Tins Dutch Cheese,2.95,19,0,Others,Set Of 2 Round Tins Dutch Cheese
Green Geisha Girl,3.75,21,0,Others,Green Geisha Girl
Blue Geisha Girl,3.75,29,0,Others,Blue Geisha Girl
Newspaper Stand,14.95,7,0,Others,Newspaper Stand
Cinammon & Orange Wreath,6.75,33,0,Others,Cinammon & Orange Wreath
Wooden Tree Christmas Scandinavian,0.85,13,0,Others,Wooden Tree Christmas Scandinavian
Rocking Horse Green Christmas,0.85,27,0,Others,Rocking Horse Green Christmas
Set Of 4 Napkin Charms 3 Keys,2.55,16,0,Others,Set Of 4 Napkin Charms 3 Keys
Set Of 4 Napkin Charms Instrument,2.55,36,0,Others,Set Of 4 Napkin Charms Instrument
Set Of 4 Napkin Charms Crowns,2.55,25,0,Others,Set Of 4 Napkin Charms Crowns
Swallow Wooden Christmas Decoration,0.85,14,0,Others,Swallow Wooden Christmas Decoration
Glitter Christmas Tree,0.85,34,0,Others,Glitter Christmas Tree
Garland With Stars And Bells,4.95,33,0,Others,Garland With Stars And Bells
"Christmas Garland Stars,Trees",3.75,29,0,Others,"Christmas Garland Stars,Trees"
Swiss Chalet Tree Decoration,0.85,8,0,Others,Swiss Chalet Tree Decoration
Bird Box Christmas Tree Decoration,0.85,15,0,Accessories,Bird Box Christmas Tree Decoration
Wooden Advent Calendar Cream,16.95,8,0,Others,Wooden Advent Calendar Cream
Doormat I Love London,7.95,36,0,Others,Doormat I Love London
Wood And Glass Medicine Cabinet,29.95,38,0,Others,Wood And Glass Medicine Cabinet
Ma Campagne Cutlery Box,14.95,18,0,Accessories,Ma Campagne Cutlery Box
Wicker Wreath Large,1.95,26,0,Others,Wicker Wreath Large
Table Lamp White Shade Wood Base,5.95,26,0,Others,Table Lamp White Shade Wood Base
Small Folkart Star Christmas Dec,0.42,40,0,Others,Small Folkart Star Christmas Dec
Small Hanging Glass+Zinc Lantern,1.45,6,0,Decoration,Small Hanging Glass+Zinc Lantern
Green Christmas Tree String 20Light,4.95,22,0,Others,Green Christmas Tree String 20Light
Black Christmas Tree 60Cm,0.65,8,0,Others,Black Christmas Tree 60Cm
Wooden Star Christmas Scandinavian,0.85,30,0,Others,Wooden Star Christmas Scandinavian
Fine Wicker Heart,1.25,8,0,Decoration,Fine Wicker Heart
Union Jack Flag Passport Cover,1.69,12,0,Others,Union Jack Flag Passport Cover
Edwardian Parasol Pink,4.6,12,0,Others,Edwardian Parasol Pink
S/4 Cacti Candles,4.25,27,0,Decoration,S/4 Cacti Candles
Pink Marshmallow Scarf Knitting Kit,2.55,16,0,Others,Pink Marshmallow Scarf Knitting Kit
6 Chocolate Love Heart T-Lights,1.69,31,0,Decoration,6 Chocolate Love Heart T-Lights
3 Traditional Cookie Cutters Set,2.1,32,0,Others,3 Traditional Cookie Cutters Set
Childrens Spaceboy Mug,1.65,10,0,Kitchen,Childrens Spaceboy Mug
Mirrored Wall Art Skulls,3.75,40,0,Others,Mirrored Wall Art Skulls
Cowboys And Indians Birthday Card,0.42,38,0,Others,Cowboys And Indians Birthday Card
Ring Of Roses Birthday Card,0.42,34,0,Others,Ring Of Roses Birthday Card
Alarm Clock Bakelike Chocolate,3.75,8,0,Others,Alarm Clock Bakelike Chocolate
Ceramic Cake Design Spotted Mug,1.49,21,0,Kitchen,Ceramic Cake Design Spotted Mug
Lipstick Pen Fuschia,0.42,22,0,Others,Lipstick Pen Fuschia
Green 3 Piece Polkadot Cutlery Set,3.75,33,0,Others,Green 3 Piece Polkadot Cutlery Set
Painted Metal Pears Assorted,1.69,15,0,Others,Painted Metal Pears Assorted
Colour Glass. Star T-Light Holder,3.25,33,0,Others,Colour Glass. Star T-Light Holder
Swallows Greeting Card,0.42,15,0,Others,Swallows Greeting Card
"Letter ""M"" Bling Key Ring",1.25,35,0,Others,"Letter ""M"" Bling Key Ring"
"Letter ""V"" Bling Key Ring",1.25,36,0,Others,"Letter ""V"" Bling Key Ring"
"Letter ""S"" Bling Key Ring",1.25,21,0,Others,"Letter ""S"" Bling Key Ring"
Kids Rain Mac Pink,0.85,30,0,Others,Kids Rain Mac Pink
Square Floor Cushion Vintage Red,7.95,16,0,Others,Square Floor Cushion Vintage Red
Blue Diamante Pen In Gift Box,4.95,38,0,Accessories,Blue Diamante Pen In Gift Box
36 Pencils Tube Skulls,1.25,22,0,Others,36 Pencils Tube Skulls
Green Fern Journal,2.55,35,0,Others,Green Fern Journal
Black Ear Muff Headphones,5.49,10,0,Others,Black Ear Muff Headphones
Assorted Tutti Frutti Mirror,1.25,11,0,Others,Assorted Tutti Frutti Mirror
Set Of 4 Rose Botanical Candles,3.75,39,0,Decoration,Set Of 4 Rose Botanical Candles
Felt Egg Cosy Blue Rabbit,0.85,40,0,Others,Felt Egg Cosy Blue Rabbit
Love Heart Sock Hanger,1.65,14,0,Decoration,Love Heart Sock Hanger
Funky Monkey Gift Bag Medium,0.85,12,0,Accessories,Funky Monkey Gift Bag Medium
Origami Vanilla Incense Cones,3.36,24,0,Others,Origami Vanilla Incense Cones
Fairy Dreams Incense,0.43,39,0,Others,Fairy Dreams Incense
Dragons Blood Incense,0.43,17,0,Others,Dragons Blood Incense
First Class Passport Cover,4.21,40,0,Others,First Class Passport Cover
Tropical Passport Cover,4.21,11,0,Others,Tropical Passport Cover
Cherry Blossom Luggage Tag,2.51,8,0,Others,Cherry Blossom Luggage Tag
Pink Polkadot Childrens Umbrella,6.77,35,0,Others,Pink Polkadot Childrens Umbrella
Red Retrospot Childrens Umbrella,6.77,30,0,Others,Red Retrospot Childrens Umbrella
Floral Soft Car Toy,7.62,10,0,Toys,Floral Soft Car Toy
Mousey Long Legs Soft Toy,5.06,15,0,Toys,Mousey Long Legs Soft Toy
Green Cat Floral Cushion Cover,10.17,21,0,Others,Green Cat Floral Cushion Cover
Red Retrospot Shopper Bag,2.51,16,0,Accessories,Red Retrospot Shopper Bag
Blue Polkadot Washing Up Gloves,4.21,19,0,Others,Blue Polkadot Washing Up Gloves
Blue Paisley Sketchbook,7.62,24,0,Others,Blue Paisley Sketchbook
Zinc Heart Lattice T-Light Holder,2.51,35,0,Decoration,Zinc Heart Lattice T-Light Holder
Blue Pot Plant Candle,7.62,32,0,Decoration,Blue Pot Plant Candle
Rose Du Sud Drawstring Bag,3.36,18,0,Accessories,Rose Du Sud Drawstring Bag
Dark Bird House Tree Decoration,1.28,24,0,Others,Dark Bird House Tree Decoration
Vintage Red Teatime Mug,2.51,37,0,Kitchen,Vintage Red Teatime Mug
"Large Cake Towel, Chocolate Spots",13.57,36,0,Others,"Large Cake Towel, Chocolate Spots"
Large Cake Towel Pink Spots,13.57,34,0,Others,Large Cake Towel Pink Spots
Gold Fishing Gnome,12.72,20,0,Others,Gold Fishing Gnome
Home Sweet Home Metal Sign,5.91,13,0,Others,Home Sweet Home Metal Sign
3D Hearts Honeycomb Paper Garland,5.91,24,0,Decoration,3D Hearts Honeycomb Paper Garland
Pastel Colour Honeycomb Fan,3.36,19,0,Others,Pastel Colour Honeycomb Fan
Set/4 Badges Dogs,2.51,15,0,Others,Set/4 Badges Dogs
Salle De Bain Hook,2.51,9,0,Others,Salle De Bain Hook
Vintage Kitchen Print Fruits,5.06,22,0,Others,Vintage Kitchen Print Fruits
Vintage Kitchen Print Seafood,5.06,24,0,Others,Vintage Kitchen Print Seafood
Stripey Chocolate Nesting Boxes,5.91,35,0,Accessories,Stripey Chocolate Nesting Boxes
Toast Its - Fairy Flower,2.51,31,0,Others,Toast Its - Fairy Flower
Basket Of Toadstools,2.51,23,0,Others,Basket Of Toadstools
12 Ivory Rose Peg Place Settings,2.51,16,0,Others,12 Ivory Rose Peg Place Settings
Red Retrospot Pudding Bowl,8.47,28,0,Others,Red Retrospot Pudding Bowl
Ceramic Birdhouse Crested Tit Small,5.91,27,0,Others,Ceramic Birdhouse Crested Tit Small
Dr. Jam'S Arouzer Stress Ball,4.21,7,0,Others,Dr. Jam'S Arouzer Stress Ball
Assorted Tutti Frutti Notebook,4.21,36,0,Others,Assorted Tutti Frutti Notebook
Assorted Tutti Frutti Small Purse,2.51,15,0,Others,Assorted Tutti Frutti Small Purse
Ridged Glass Posy Vase,3.36,10,0,Others,Ridged Glass Posy Vase
Red Spot Ceramic Drawer Knob,2.51,27,0,Others,Red Spot Ceramic Drawer Knob
Small Medina Stamped Metal Bowl,2.51,36,0,Others,Small Medina Stamped Metal Bowl
Mock Lobster Fridge Magnet,1.66,35,0,Others,Mock Lobster Fridge Magnet
Big Doughnut Fridge Magnets,8.47,25,0,Others,Big Doughnut Fridge Magnets
Gaolers Keys Decorative Garden,8.47,8,0,Others,Gaolers Keys Decorative Garden
Decorative Flore Bathroom Bottle,2.51,21,0,Others,Decorative Flore Bathroom Bottle
Glitter Heart Garland With Bells,7.62,8,0,Decoration,Glitter Heart Garland With Bells
Assorted Creepy Crawlies,0.85,23,0,Others,Assorted Creepy Crawlies
Pink Diamante Pen In Gift Box,4.21,35,0,Accessories,Pink Diamante Pen In Gift Box
Potting Shed Tea Mug,3.36,7,0,Kitchen,Potting Shed Tea Mug
Kings Choice Mug,3.36,16,0,Kitchen,Kings Choice Mug
Potting Shed Twine,4.21,15,0,Others,Potting Shed Twine
"Key Fob , Garage Design",1.66,14,0,Others,"Key Fob , Garage Design"
Pharmacie First Aid Tin,13.57,37,0,Others,Pharmacie First Aid Tin
Chocolate This Way Metal Sign,4.21,15,0,Others,Chocolate This Way Metal Sign
Set Of 36 Paisley Flower Doilies,2.98,25,0,Others,Set Of 36 Paisley Flower Doilies
Ribbon Reel Lace Design,4.21,39,0,Others,Ribbon Reel Lace Design
Paper Chain Kit Empire,5.91,9,0,Others,Paper Chain Kit Empire
Empire Tissue Box,2.51,35,0,Accessories,Empire Tissue Box
Set Of 2 Tea Towels Ping Microwave,2.51,28,0,Kitchen,Set Of 2 Tea Towels Ping Microwave
"Diamante Heart Shaped Wall Mirror,",11.02,30,0,Decoration,"Diamante Heart Shaped Wall Mirror,"
Cake Stand Victorian Filigree Large,8.47,7,0,Others,Cake Stand Victorian Filigree Large
Wood Stamp Set Thank You,3.36,39,0,Others,Wood Stamp Set Thank You
"Hook, 1 Hanger ,Magic Garden",1.66,9,0,Others,"Hook, 1 Hanger ,Magic Garden"
Magic Garden Felt Garland,4.21,29,0,Others,Magic Garden Felt Garland
6 Egg House Painted Wood,16.13,16,0,Others,6 Egg House Painted Wood
Tea Cosy Blue Stripe,5.06,32,0,Kitchen,Tea Cosy Blue Stripe
Five Cats Hanging Decoration,5.91,11,0,Others,Five Cats Hanging Decoration
Blue Polkadot Kids Bag,4.21,15,0,Accessories,Blue Polkadot Kids Bag
Mobile Vintage Hearts,11.87,24,0,Decoration,Mobile Vintage Hearts
Woodland Party Bag + Sticker Set,3.36,19,0,Accessories,Woodland Party Bag + Sticker Set
Home Garland Painted Zinc,3.36,32,0,Others,Home Garland Painted Zinc
Illustrated Cat Bowl,5.06,27,0,Others,Illustrated Cat Bowl
Paperweight Vintage Collage,5.06,21,0,Others,Paperweight Vintage Collage
Money Box Pocket Money Design,2.51,40,0,Accessories,Money Box Pocket Money Design
Money Box Biscuits Design,2.51,12,0,Accessories,Money Box Biscuits Design
Lipstick Pen Baby Pink,0.85,23,0,Others,Lipstick Pen Baby Pink
Enamel Colander Cream,10.17,18,0,Others,Enamel Colander Cream
Cast Iron Hook Garden Fork,5.06,34,0,Others,Cast Iron Hook Garden Fork
Cast Iron Hook Garden Trowel,5.06,32,0,Others,Cast Iron Hook Garden Trowel
Wooden Union Jack Bunting,12.72,33,0,Others,Wooden Union Jack Bunting
Cabin Bag Vintage Paisley,59.53,21,0,Accessories,Cabin Bag Vintage Paisley
Magic Drawing Slate Purdey,0.85,19,0,Others,Magic Drawing Slate Purdey
Feltcraft Hairband Pink And Blue,1.66,8,0,Others,Feltcraft Hairband Pink And Blue
Christmas Retrospot Heart Wood,1.66,31,0,Decoration,Christmas Retrospot Heart Wood
Strawberry Fairy Cake Teapot,11.02,40,0,Kitchen,Strawberry Fairy Cake Teapot
Pink Baby Bunting,5.91,11,0,Others,Pink Baby Bunting
French Garden Sign Blue Metal,2.51,8,0,Others,French Garden Sign Blue Metal
Doormat Welcome To Our Home,7.95,12,0,Others,Doormat Welcome To Our Home
Poppy'S Playhouse Livingroom,4.21,28,0,Others,Poppy'S Playhouse Livingroom
Poppy'S Playhouse Bathroom,4.21,15,0,Others,Poppy'S Playhouse Bathroom
Large Yellow Babushka Notebook,2.51,8,0,Others,Large Yellow Babushka Notebook
Brocante Coat Rack,20.38,6,0,Others,Brocante Coat Rack
White Brocante Soap Dish,5.91,26,0,Others,White Brocante Soap Dish
Round Cake Tin Vintage Green,16.13,15,0,Others,Round Cake Tin Vintage Green
Soap Dish Brocante,5.91,38,0,Others,Soap Dish Brocante
Number Tile Cottage Garden 2,4.21,13,0,Others,Number Tile Cottage Garden 2
Novelty Biscuits Cake Stand 3 Tier,20.38,35,0,Others,Novelty Biscuits Cake Stand 3 Tier
Oven Mitt Apples Design,2.98,28,0,Others,Oven Mitt Apples Design
Childrens Apron Apples Design,4.21,38,0,Others,Childrens Apron Apples Design
Christmas Metal Postcard With Bells,16.13,19,0,Others,Christmas Metal Postcard With Bells
Dolly Girl Childrens Egg Cup,2.51,38,0,Kitchen,Dolly Girl Childrens Egg Cup
Ivory String Curtain With Pole,19.53,15,0,Others,Ivory String Curtain With Pole
Blue Felt Hanging Heart W Flower,1.66,19,0,Decoration,Blue Felt Hanging Heart W Flower
Pink Felt Hanging Heart W Flower,1.66,24,0,Decoration,Pink Felt Hanging Heart W Flower
Folkart Clip On Stars,1.66,37,0,Others,Folkart Clip On Stars
Folkart Heart Napkin Rings,3.36,8,0,Decoration,Folkart Heart Napkin Rings
Folk Art Metal Star T-Light Holder,1.66,16,0,Others,Folk Art Metal Star T-Light Holder
Ceramic Cake Bowl + Hanging Cakes,5.91,32,0,Others,Ceramic Cake Bowl + Hanging Cakes
Yellow/Pink Ceramic Candle Holder,3.36,22,0,Decoration,Yellow/Pink Ceramic Candle Holder
Sunset Colour Chunky Knitted Throw,11.02,13,0,Others,Sunset Colour Chunky Knitted Throw
Woven Berries Cushion Cover,4.21,40,0,Others,Woven Berries Cushion Cover
Tea Time Party Bunting,8.47,8,0,Kitchen,Tea Time Party Bunting
Tea Time Kitchen Apron,12.72,15,0,Kitchen,Tea Time Kitchen Apron
Blue Happy Birthday Bunting,11.02,31,0,Others,Blue Happy Birthday Bunting
Pink Happy Birthday Bunting,11.02,26,0,Others,Pink Happy Birthday Bunting
Carousel Design Washbag,4.21,31,0,Accessories,Carousel Design Washbag
Love Heart Pocket Warmer,3.36,26,0,Decoration,Love Heart Pocket Warmer
A4 Wall Tidy Blue Office,1.49,34,0,Others,A4 Wall Tidy Blue Office
Columbian Cube Candle,1.66,34,0,Decoration,Columbian Cube Candle
Corona Mexican Tray,8.47,30,0,Others,Corona Mexican Tray
Area Patrolled Metal Sign,4.21,18,0,Others,Area Patrolled Metal Sign
Fanny'S Rest Stopmetal Sign,4.21,10,0,Others,Fanny'S Rest Stopmetal Sign
Midnight Glamour Scarf Knitting Kit,2.51,19,0,Others,Midnight Glamour Scarf Knitting Kit
Yellow Metal Chicken Heart,3.36,20,0,Decoration,Yellow Metal Chicken Heart
Pack 20 English Rose Paper Napkins,1.66,12,0,Others,Pack 20 English Rose Paper Napkins
3D Sheet Of Dog Stickers,1.69,38,0,Others,3D Sheet Of Dog Stickers
3D Sheet Of Cat Stickers,1.69,6,0,Others,3D Sheet Of Cat Stickers
Tall Rococo Candle Holder,16.98,37,0,Decoration,Tall Rococo Candle Holder
White Travel Alarm Clock,2.51,20,0,Others,White Travel Alarm Clock
Grass Hopper Wooden Wall Clock,5.91,14,0,Others,Grass Hopper Wooden Wall Clock
Jungle Popsicles Ice Lolly Holders,2.51,8,0,Others,Jungle Popsicles Ice Lolly Holders
Large Tahiti Beach Bag,11.87,18,0,Accessories,Large Tahiti Beach Bag
Hand Towel Pink Flower And Daisy,4.21,6,0,Others,Hand Towel Pink Flower And Daisy
Assorted Colour T-Light Holder,0.99,9,0,Others,Assorted Colour T-Light Holder
Rectangular Shaped Mirror,3.36,20,0,Others,Rectangular Shaped Mirror
Set Of 3 Coney Island Oval Boxes,10.17,37,0,Accessories,Set Of 3 Coney Island Oval Boxes
Set/4 Blue Flower Candles In Bowl,3.36,16,0,Decoration,Set/4 Blue Flower Candles In Bowl
French Enamel Candleholder,4.21,37,0,Decoration,French Enamel Candleholder
Black Enchanted Forest Placemat,3.36,7,0,Others,Black Enchanted Forest Placemat
Beaded Crystal Heart Pink On Stick,0.85,19,0,Decoration,Beaded Crystal Heart Pink On Stick
Set/6 Pink Bird T-Light Candles,4.21,25,0,Decoration,Set/6 Pink Bird T-Light Candles
Mini Painted Garden Decoration,1.66,15,0,Others,Mini Painted Garden Decoration
Set Of 6 3D Kit Cards For Kids,1.66,29,0,Others,Set Of 6 3D Kit Cards For Kids
Set/3 Decoupage Stacking Tins,10.17,9,0,Others,Set/3 Decoupage Stacking Tins
Black Vintage Earrings,4.24,28,0,Others,Black Vintage Earrings
Gold M.O.P Orbit Drop Earrings,4.24,39,0,Others,Gold M.O.P Orbit Drop Earrings
Gold M.O.P Orbit Bracelet,5.51,17,0,Others,Gold M.O.P Orbit Bracelet
New Baroque B'Fly Necklace Green,8.49,31,0,Others,New Baroque B'Fly Necklace Green
"Flower Glass Garld Neckl36""Turquois",8.07,36,0,Others,"Flower Glass Garld Neckl36""Turquois"
Murano Style Glass Bracelet Black,3.81,5,0,Others,Murano Style Glass Bracelet Black
Cracked Glaze Necklace Red,7.22,31,0,Others,Cracked Glaze Necklace Red
Cracked Glaze Earrings Red,2.54,7,0,Others,Cracked Glaze Earrings Red
Black Diamond Cluster Earrings,2.96,5,0,Others,Black Diamond Cluster Earrings
Blue Murano Twist Necklace,10.17,35,0,Others,Blue Murano Twist Necklace
Old Rose Combo Bead Necklace,2.96,40,0,Others,Old Rose Combo Bead Necklace
White/Pink Mini Crystals Necklace,5.51,18,0,Others,White/Pink Mini Crystals Necklace
Ant Copper Turq Boudicca Bracelet,5.09,14,0,Others,Ant Copper Turq Boudicca Bracelet
Pink & White Rosebud Ring,4.24,34,0,Others,Pink & White Rosebud Ring
Pair Butterfly Hair Clips,3.81,7,0,Others,Pair Butterfly Hair Clips
Drop Diamante Earrings Crystal,2.96,40,0,Others,Drop Diamante Earrings Crystal
Drop Diamante Earrings Green,2.96,34,0,Others,Drop Diamante Earrings Green
Amethyst Glass/Shell/Pearl Necklace,9.34,40,0,Others,Amethyst Glass/Shell/Pearl Necklace
Jade Drop Earrings W Filigree,5.09,40,0,Others,Jade Drop Earrings W Filigree
Crystal Diamante Star Brooch,5.09,40,0,Others,Crystal Diamante Star Brooch
Pink Enamel+Glass Hair Comb,2.11,18,0,Others,Pink Enamel+Glass Hair Comb
Diamond Las Vegas Necklace 45Cm,5.94,15,0,Others,Diamond Las Vegas Necklace 45Cm
"Letter ""A"" Bling Key Ring",0.85,29,0,Others,"Letter ""A"" Bling Key Ring"
"Letter ""E"" Bling Key Ring",0.85,16,0,Others,"Letter ""E"" Bling Key Ring"
Pink Floral Feltcraft Shoulder Bag,3.75,21,0,Accessories,Pink Floral Feltcraft Shoulder Bag
White Stitched Cushion Cover,6.95,32,0,Others,White Stitched Cushion Cover
Pin Cushion Babushka Red,3.35,27,0,Others,Pin Cushion Babushka Red
Pin Cushion Babushka Blue,3.35,7,0,Others,Pin Cushion Babushka Blue
Pin Cushion Babushka Pink,3.35,23,0,Others,Pin Cushion Babushka Pink
Red Retrospot Purse,2.95,40,0,Others,Red Retrospot Purse
Ladybird + Bee Raffia Food Cover,3.75,39,0,Others,Ladybird + Bee Raffia Food Cover
Home Sweet Home Mug,1.25,27,0,Kitchen,Home Sweet Home Mug
Childrens Garden Gloves Blue,1.25,12,0,Others,Childrens Garden Gloves Blue
Chrysanthemum Sketchbook,3.75,25,0,Others,Chrysanthemum Sketchbook
Vintage Union Jack Doorstop,5.95,32,0,Others,Vintage Union Jack Doorstop
Wake Up Cockerel Tile Coaster,1.25,13,0,Others,Wake Up Cockerel Tile Coaster
Rose 3 Wick Morris Box Candle,4.25,38,0,Decoration,Rose 3 Wick Morris Box Candle
Rose Scent Candle Jewelled Drawer,4.25,23,0,Decoration,Rose Scent Candle Jewelled Drawer
White Bamboo Ribs Lampshade,0.85,14,0,Others,White Bamboo Ribs Lampshade
Folding Umbrella Chocolate Polkadot,4.95,19,0,Others,Folding Umbrella Chocolate Polkadot
Cake Stand Lovebird 2 Tier White,9.95,14,0,Others,Cake Stand Lovebird 2 Tier White
3 Gardenia Morris Boxed Candles,4.25,7,0,Decoration,3 Gardenia Morris Boxed Candles
Set/4 Garden Rose Dinner Candle,1.65,18,0,Decoration,Set/4 Garden Rose Dinner Candle
Gold Print Paper Bag,0.19,32,0,Accessories,Gold Print Paper Bag
Wooden Happy Birthday Garland,2.95,11,0,Others,Wooden Happy Birthday Garland
Set/4 Badges Cute Creatures,1.25,38,0,Others,Set/4 Badges Cute Creatures
Blue Paisley Pocket Book,0.85,10,0,Others,Blue Paisley Pocket Book
Porcelain Rose Large,1.25,8,0,Others,Porcelain Rose Large
Porcelain Rose Small,0.85,23,0,Others,Porcelain Rose Small
Baking Set Spaceboy Design,4.25,36,0,Others,Baking Set Spaceboy Design
Peace Small Wood Letters,6.75,27,0,Others,Peace Small Wood Letters
Red Retrospot Apron,5.95,20,0,Others,Red Retrospot Apron
Feltcraft Doll Maria,2.95,25,0,Toys,Feltcraft Doll Maria
Party Metal Sign,1.45,10,0,Others,Party Metal Sign
Vintage Cream 3 Basket Cake Stand,9.95,13,0,Others,Vintage Cream 3 Basket Cake Stand
Doormat Respectable House,7.95,40,0,Others,Doormat Respectable House
Memo Board Retrospot Design,4.95,36,0,Others,Memo Board Retrospot Design
Pink/Yellow Flowers Handbag,1.25,24,0,Accessories,Pink/Yellow Flowers Handbag
Charlie+Lola My Room Door Sign,2.55,6,0,Others,Charlie+Lola My Room Door Sign
Christmas Card Stack Of Presents,0.42,20,0,Others,Christmas Card Stack Of Presents
Set 12 Kids Colour Chalk Sticks,0.42,9,0,Others,Set 12 Kids Colour Chalk Sticks
Spaceboy Birthday Card,0.42,11,0,Others,Spaceboy Birthday Card
Joy Large Wood Letters,9.95,28,0,Others,Joy Large Wood Letters
World War 2 Gliders Asstd Designs,0.29,5,0,Others,World War 2 Gliders Asstd Designs
Enchanted Bird Coathanger 5 Hook,4.65,30,0,Others,Enchanted Bird Coathanger 5 Hook
Cacti T-Light Candles,0.42,9,0,Decoration,Cacti T-Light Candles
Hanging Bauble T-Light Holder Small,2.1,13,0,Others,Hanging Bauble T-Light Holder Small
Balloon Water Bomb Pack Of 35,0.42,6,0,Others,Balloon Water Bomb Pack Of 35
Balloon Pump With 10 Balloons,1.95,13,0,Others,Balloon Pump With 10 Balloons
Alphabet Stencil Craft,1.25,8,0,Others,Alphabet Stencil Craft
3 Traditional Biscuit Cutters Set,2.1,15,0,Others,3 Traditional Biscuit Cutters Set
Ivory Paper Cup Cake Cases,0.42,37,0,Kitchen,Ivory Paper Cup Cake Cases
Party Invites Woodland,0.85,12,0,Others,Party Invites Woodland
Party Invites Balloon Girl,0.85,40,0,Others,Party Invites Balloon Girl
Lovely Bonbon Sticker Sheet,0.85,39,0,Others,Lovely Bonbon Sticker Sheet
Asstd Design 3D Paper Stickers,0.85,38,0,Others,Asstd Design 3D Paper Stickers
Cute Cats Tape,0.65,12,0,Others,Cute Cats Tape
Pack Of 12 Coloured Pencils,0.85,9,0,Others,Pack Of 12 Coloured Pencils
Toast Its - I Love You,1.25,33,0,Others,Toast Its - I Love You
Empire Birthday Card,0.42,19,0,Others,Empire Birthday Card
Tea Party Birthday Card,0.42,35,0,Kitchen,Tea Party Birthday Card
Card Cat And Tree,0.42,14,0,Others,Card Cat And Tree
Card Dog And Ball,0.42,37,0,Others,Card Dog And Ball
Penny Farthing Birthday Card,0.42,8,0,Others,Penny Farthing Birthday Card
Blue Stripe Ceramic Drawer Knob,1.25,26,0,Others,Blue Stripe Ceramic Drawer Knob
White Spot Blue Ceramic Drawer Knob,1.25,9,0,Others,White Spot Blue Ceramic Drawer Knob
Embossed Glass Tealight Holder,1.25,17,0,Kitchen,Embossed Glass Tealight Holder
Watering Can Green Dinosaur,1.95,33,0,Others,Watering Can Green Dinosaur
Watering Can Blue Elephant,1.95,28,0,Others,Watering Can Blue Elephant
Flying Pig Watering Can,2.95,10,0,Others,Flying Pig Watering Can
French Blue Metal Door Sign 1,1.25,34,0,Others,French Blue Metal Door Sign 1
French Bathroom Sign Blue Metal,1.65,33,0,Others,French Bathroom Sign Blue Metal
"Cakestand, 3 Tier, Loveheart",9.95,23,0,Decoration,"Cakestand, 3 Tier, Loveheart"
Glass Bell Jar Small,3.95,31,0,Others,Glass Bell Jar Small
Glass Bell Jar Large,8.5,9,0,Others,Glass Bell Jar Large
Fridge Magnets La Vie En Rose,0.85,37,0,Others,Fridge Magnets La Vie En Rose
Brocante Shelf With Hooks,10.75,17,0,Others,Brocante Shelf With Hooks
Green Polkadot Bowl,1.25,10,0,Others,Green Polkadot Bowl
Picture Frame Wood Triple Portrait,6.75,35,0,Others,Picture Frame Wood Triple Portrait
Set3 Book Box Green Gingham Flower,4.25,13,0,Accessories,Set3 Book Box Green Gingham Flower
Round Cake Tin Vintage Red,7.95,7,0,Others,Round Cake Tin Vintage Red
Retro Plastic Elephant Tray,0.85,28,0,Others,Retro Plastic Elephant Tray
Rainbow Pegs Photo Clip String,0.65,21,0,Others,Rainbow Pegs Photo Clip String
Teatime Pen Case & Pens,0.85,17,0,Kitchen,Teatime Pen Case & Pens
Photo Frame 3 Classic Hanging,9.95,40,0,Others,Photo Frame 3 Classic Hanging
3D Traditional Christmas Stickers,1.25,36,0,Others,3D Traditional Christmas Stickers
Seaside Flying Disc,1.25,38,0,Others,Seaside Flying Disc
Peg Bag Apples Design,2.55,19,0,Accessories,Peg Bag Apples Design
Grey Floral Feltcraft Shoulder Bag,3.75,17,0,Accessories,Grey Floral Feltcraft Shoulder Bag
Set/3 Red Gingham Rose Storage Box,3.75,22,0,Accessories,Set/3 Red Gingham Rose Storage Box
Small Red Retrospot Mug In Box,3.75,11,0,Kitchen,Small Red Retrospot Mug In Box
12 Pencils Tall Tube Red Retrospot,0.85,12,0,Others,12 Pencils Tall Tube Red Retrospot
Red Retrospot Traditional Teapot,7.95,19,0,Kitchen,Red Retrospot Traditional Teapot
Dairy Maid Pudding Bowl,3.75,23,0,Others,Dairy Maid Pudding Bowl
Assorted Cakes Fridge Magnets,0.65,24,0,Others,Assorted Cakes Fridge Magnets
Food Container Set 3 Love Heart,1.95,24,0,Decoration,Food Container Set 3 Love Heart
Do Not Touch My Stuff Door Hanger,1.45,13,0,Others,Do Not Touch My Stuff Door Hanger
Keep Out Boys Door Hanger,1.45,9,0,Others,Keep Out Boys Door Hanger
Moody Boy Door Hanger,1.45,35,0,Others,Moody Boy Door Hanger
Filigris Heart With Butterfly,1.25,32,0,Decoration,Filigris Heart With Butterfly
"Decoration Hen On Nest, Hanging",1.65,31,0,Others,"Decoration Hen On Nest, Hanging"
Hen House Decoration,1.65,35,0,Others,Hen House Decoration
Pack Of 12 Sticky Bunnies,0.65,7,0,Others,Pack Of 12 Sticky Bunnies
Mini Wooden Happy Birthday Garland,1.69,22,0,Others,Mini Wooden Happy Birthday Garland
Wood Stamp Set Best Wishes,1.65,20,0,Others,Wood Stamp Set Best Wishes
Wood Stamp Set Happy Birthday,1.65,32,0,Others,Wood Stamp Set Happy Birthday
Glamorous Mug,1.25,25,0,Kitchen,Glamorous Mug
Gardenia 3 Wick Morris Boxed Candle,4.25,11,0,Decoration,Gardenia 3 Wick Morris Boxed Candle
Chest 7 Drawer Ma Campagne,24.95,39,0,Others,Chest 7 Drawer Ma Campagne
Jumbo Bag Spaceboy Design,1.95,24,0,Accessories,Jumbo Bag Spaceboy Design
Airline Bag Vintage Jet Set Red,4.25,12,0,Accessories,Airline Bag Vintage Jet Set Red
Cosy Slipper Shoes Large Green,2.95,27,0,Others,Cosy Slipper Shoes Large Green
White Jewelled Heart Decoration,0.85,26,0,Decoration,White Jewelled Heart Decoration
Chinese Dragon Paper Lanterns,0.42,39,0,Decoration,Chinese Dragon Paper Lanterns
Milk Pan Pink Polkadot,3.75,30,0,Others,Milk Pan Pink Polkadot
Boom Box Speaker Boys,5.95,19,0,Accessories,Boom Box Speaker Boys
Small Pink Magic Christmas Tree,0.85,37,0,Others,Small Pink Magic Christmas Tree
Recycled Pencil With Rabbit Eraser,0.21,35,0,Others,Recycled Pencil With Rabbit Eraser
Blue Calculator Ruler,1.25,31,0,Others,Blue Calculator Ruler
Red Flock Love Heart Photo Frame,0.85,11,0,Decoration,Red Flock Love Heart Photo Frame
Scented Candle In Digitalis Tin,2.1,26,0,Decoration,Scented Candle In Digitalis Tin
